аршаҳаҭгақәагьы, ҳаҭыр зқәу ари аразриад сшаҵанакуа ала.	свидетельств о том, что я отношусь к этому почтенному разряду.
шәареи сареи ҳаамҭа иаҵанакуа ауаҩы иаҳасабала,	как человек нашего с вами времени,
аҩнытә философ иаҳасабала,	будучи домашним философом,
сара, ҳәарада, даара игәнызго ыҟоуп,	я, конечно, сильно переживаю о некоторых вещах,
хаҭала исыхҭысуа, мамзаргьы аурыс,	которые происходят не просто со мной, или же с русскими,
аԥсуа, америка жәларқәагьы зҭагылоу акәым.	или с абхазами, с американцами.
адунеи зегьы исгәаԥхо акы ахҭысуеит.	со всем миром происходит что- то такое, что лично меня далеко не устраивает.
сареи сеиԥш ҳаамҭазтәи адунеи ауааԥсыра гәыԥҩык ирыдрымкыло акы.	так же, как и многих людей нашего современного мира.
уи ихадоу, шьаҭанкыла ак ацәыӡроуп,	это утрата чего- то основополагающего и главного,
амазаратә ган акәӡам, иреалтәу ари аԥсҭазаараҿы алшара дуқәа узҭо	не в имущественном отношении, не в накоплении каких- то научных энергий, знаний,
анаукатә енергиақәеи, адыррақәеи ракәӡам сызҿу.	позволяющих иметь какие- то большие возможности в этой реальной жизни.
ҳара иҳарӡит аԥеиԥш ду иадҳәалаз,	мы утратили что- то главное, что обещает великое будущее,
ауаатәыҩса рабиԥарақәа зегьы ахьтәы шәышықәса ҳәа изызгәышьуаз,	которое люди, живущие во все поколения, лелеют как мечту о золотом веке,
анцәа иаҳра иадҳәалаз ихадоу акы. иҳарӡыз ахьтәы шәышықәсеи,	о царстве божьем. миф об утраченном золотом веке
уи архынҳәреи рмиф. ари агәазыҳәарахь ауаа ирыхоз амч хада ырӡуп,	и возвращении его. главная сила, которая подвигает людей к этой мечте утрачена,
даҽакала иуҳәозар,	и все свелось к совершенному чистогану,
ауаатәыҩса рымчхара аԥсыҽхара иаҿуп,	и происходит ослабление колоссальных сил человечества,
анаука аенергетика ду шеидыркылазгьы,	несмотря на то, что люди набрали громадную энергетику науки,
гәарҭак адыррақәа шеизыргазгьы, аԥсабара азакәанқәа ишрылалазгьы,	собрали много познаний, вторглись в закономерности природы,
афизикатә мчреи алшареи шдырҳазгьы.	и обрели физическую мощь и способность.
уи инаваргыланы ицәырҵит ҳдунеи аҵыхәтәа иадҳәалоу иреалтәу аҭагылазаашьа,	вместе с этим настала абсолютно реальная ситуация о конце нашего мира,
аглобалтә ԥхарреи,	из- за глобального потепления, из- за того, что может быть
адунеи ықәызхыр зылшо аиадертә бџьареидкылеи,	уничтожение мира в результате колоссального накопления ядерного оружия,
иҟалап, аиадертә бџьар аиҳагьы ишәарҭоу акәзар,	и, может быть, более страшного, чем ядерное оружие,
амассатә нырҵәаразы ахимиатә, апсихологиатә бџьар.	химического, психологического оружия массового уничтожения.
анаукеи адыррақәеи ирыбзоураны, ирацәаны ипозитивтәу алагамҭеи, аенергеи реингалара ала,	вместе с накоплением огромных позитивных начал и энергий
ҳара акыргьы ҳуашәшәырахеит,	через науку и познание, мы обрели колоссальную уязвимость
ҳагьшәарҭахеит ҳдунеи иреалтәу аҵыхәтәа аҿаԥхьа.	и опасность перед реальным концом нашего мира.
избан, ҳзазааигәахазеи уи ҳара?	почему мы к этому подошли?
сымацара сакәӡам, ихәыцуа ауаа зегьы уи амзызқәа еилыркаауеит.	не только я, а все мыслящие люди видят причины этого.
мзысс иҟоу убри ауп, ҳара адоуҳатә енергиа ҳцәыӡит, адоуҳатә лагамҭа ыӡит.	причины этого, что у нас пропала духовная энергия, пропало духовное начало.
уи адоуҳатә лагамҭа	и это духовное начало
сара избеит мураҭ иаӷан ишәҟәы « аамсҭа қьабза » аҟны.	я увидел в книге мурата ягана « аамста кябза ».
ари ашәҟәы ҳамҭас исиҭеит сжәытә ҩыза руслан џьапуа,	эту книгу подарил мне мой давний друг руслан джопуа,
сасра санизаа. ари ашәҟәы аԥхьара салагеит,	когда я к нему приехал в гости. я начал читать эту книгу,
иаалырҟьангьы еилыскааит ари ашәҟәы аҿы схазы аҭак шызбо,	и вдруг понял, что в этой книге я нахожу для себя ответ,
иҟаҵатәузеи, ҳаамҭазтәи апокалипсистә ҭагылазаашьа аԥсахра азҵаараҿы?	что же нужно, чтобы преодолеть апокалиптическую ситуацию нашего времени?
уи сара сзы зегь иреиҳау ҳамҭоуп.	это, ведь, был самый большой дар для меня.
издызбалеи уи зегьы сара?	в чем я увидел это все?
ашәҟәы алагамҭа зынӡа имариоуп.	начинается книга очень даже просто.
уи иҳәоит аханатә канада ауааи иареи аицәажәарақәа шрымаз,	он говорит, что у него в начале были беседы с людьми в канаде о том,
иԥсҭазаара ҭәны, ихарҭәааны аҟаҵаразы	как человеку использовать все данные ему возможности для того,
ауаҩы имоу алшарақәа зегьы ихы ишаирхәаша,	чтобы жизнь его была абсолютно полной и наполненной,
ихарҭәаау, ибарақьаҭроу аԥсҭазааразы	чтобы не упустить всех ему данных возможностей
имоу алшарақәа ицәымӡырц иҟаиҵаша иазкны.	для полноценной и изобильной жизни.
анаҩс уи аҳәара далагеит	потом он стал говорить о том, что
кавказ ишыҟаз ижәытәӡоу адоуҳатә акультура,	существовала древняя духовная культура на кавказе,
20 нызқь шықәса еиҳаны изхыҵуа, ус шакәу зыршаҳаҭуагьы ыҟоуп,	которая уходит корнями за 20 тысяч лет, свидетельства есть такие,
насгьы уи акультура кавказ иит хыхь ҳаицәажәара алагамҭазы	и эта культура родилась на кавказе задолго до тех цивилизаций,
зыӡбахә шәымаз ацивилизациақәа цәырҵаанӡагьы.	о которых вы говорили в начале нашей беседы.
уи мысратәи, месопатамиатәи, индиатәи, китаитәи уҳәа.	это и египетская, и месопотамская, и индийская, и китайская.
анаукатә дырра дуӡӡақәеи, атехнологиатә лшарақәеи шҳамоугьы,	обладая колоссальными научными знаниями
ҳара ҳанхоит мураҭ иаӷан ишәҟәаҿы	и возможностями технологическими, мы живем без этой энергии,
зыӡбахә имоу аенергиа ҳамаӡамкәа.	о которой говорит мурат яган в своей книге.
аханатә инаркны ахдырра хыҵхырҭас иамоу аенергиа, мамзаргьы ахьышьҭра,	у энергии, источника, откуда изначально исходит сознание, а вместе с сознанием накопленные знания,
ахдырра инадҳәаланы еизгоу адыррақәагьы ирхылҿиаауеит арҿиаразы	и исходит самая главная воля к тому, чтобы
агәаҳәара хада узҭо, улшарақәа зегьы рааԥшра улзыршо.	созидать во имя полного осуществления своих возможностей.
абар, ахыҵхырҭа иазку арҭ адыррақабар,	вот эти сведения об источнике,
кавказ ельбруси казбеки рыбжьара ицәырҵыз,	которые возникли на кавказе, между эльбрусом и казбеком,
ԥсҭазаарала еимырдон ара, кавказ,	передавались живым образом именно здесь, на кавказе,
биԥарацыԥхьаӡа, акраамҭа.	из поколения в поколение, в течение этого огромного времени.
мураҭ иаӷан иҳәоит, саргьы уи сиқәшаҳаҭуп,	мурат яган говорит, я абсолютно с ним согласен, что истоком
адунеи адоуҳатә рҵарақәа зегьы рхьышьҭра, сара сызлацәажәо мураҭ иаӷан иҳаҵаиҳәо роуп,	всех духовных учений на земле, я говорю о сведениях, о которых говорит мурат яган,
аддоуҳатә хьышьҭра азхәыцшьа аарԥшын,	это на кавказе были открыты понятия истока духовного,
адоуҳатә енергиагьы, ауаҩы	духовной энергии для созидания человеком
иԥсҭазаашьа иҷыдоу аформа амчала	с помощью его особой формы существования,
илшарақәа зегьы раартуа, ралыршаразы аҭагылазаашьа изҭо.	которое позволяет человеку полностью реализовать свои возможности.
сара агәрасгаӡомызт,	я бы не мог этого понять,
хаҭала уи аҩыза алахьынҵа смоузҭгьы. акраамҭа уаҩы исызиаҳәомызт,	если бы сам не прошел такую судьбу. я долго никому не мог признаться,
слитературатә рҿиараҿы	что в своем творчестве литературном,
сызхьыԥшуа акыршықәса исҵоз,	я исходил не из того, что слишком много чего- то изучил,
сзыԥхьоз, сыҩныҵҟа еизызгаз ракәӡамызт,	что- то прочитал, все это накопил в себе,
уи оуп аҩра сылзыршозгьы. сара еидыскыломызт крызҵазкуаз аматериалқәа.	и это позволило мне писать. я не собирал материалы какие- то очень важные.
аханатә аахыс сара сыҩуан, мураҭ иаӷан ихы ишазиҳәаз еиԥш:	знаете, с самого начала я писал так, как мурат яган сказал о себе:
« аӡәы аказы дансазҵаауа, акгьы сыздыруам, аха аҭак ҟасҵоит	« когда меня спрашивает о чем- то, я не знаю ничего, но я отвечаю
ииашаны ишысҳәо ала ахдырра сыманы ».	с полным осознанием того, что я говорю правильно ».
саргьы изыҩуан имариамыз саԥҵамҭақәа « белка », иара убас егьырҭ иҩымҭақәагьы,	я тоже писал свои сложнейшие вещи, « белку » и другие произведения,
смагиатә реализм зегьы, ишырҳәало еиԥш,	и весь свой магический реализм, как говорится,
ахаангьы аханатә исыздыруамызт изыҩраны сыҟан.	и никогда заранее не знал, что я буду писать.
аплан ахаангьы иҟасҵомызт, аматериалқәа еидыскыломызт,	я не строил никогда планов, не собирал материалы,
аҩымҭа аконцепциа еиқәсыршәомызт, ус баша снатәаны	не составлял концепции произведения, просто садился
аҩра салагон, мураҭ иаӷан дгыланы аҭак шыҟаиҵоз еиԥш, акы ианиазҵаауаз.	и писал, как мурат яган просто стоял и отвечал, когда его спрашивали.
ахыҵхырҭеи ауаҩи ари реимадара ныҟәызго маҷӡоуп,	вот эта связь с источником, наверное, дана некоторым людям,
саргьы иаӷан иԥхьара саналага, уи аимадара сцәа ианырит	и когда я стал читать ягана, я вдруг почувствовал это родство
сырҿиара иадкыланы.	в подходе к своему творчеству.
иара изгьы ирҿиара – « аамысҭа қьабза » ауп,	и для него творчество – это его « аамста кябза »,
ауаа рзы иаԥҵоу. абри аҩыза аиҿырԥшра шана,	которая создана для людей. вот это поразительное совпадение,
шәзеиԥш хыҵхырҭа здыруа иузгәакьоу адоуҳатә ԥстәык анырра,	узнавание родственного, духовного существа, которому известен один общий источник,
иареи сареи ҳазныз иарбан аамҭазаалакгьы, иарбан ҭыԥзаалакгьы ҳахьынхоз,	несмотря на то, в каком время мы с ним жили, в каких местах
егьа ҳаиҟәыҭхазаргьы: аҭагылазаашьақәа, аҭоурых, агеографиа рыла.	мы жили, как бы не были разделены: обстоятельствами, историей, географией.
егьа ус акәзаргьы, уи сареи ҳаизгәакьахеит. уи иџьашьахәу метафорак имоуп.	тем не менее, мы оказались с ним родственными. у его есть поразительная метафора.
абар, зхыб кылжәоу ажәытә ҩны, иҳәеит,	он говорит, вот старый дом с продырявленной крышей,
ахыб икылсны амра ашәахәақәа аҩны лашьца иҩнаҷҷоит.	и прорывается в темноту помещения от солнца много лучей.
урҭ рахьтә иарбан шәахәоу иаанукылалакгьы,	стоит любой из этих лучей поймать,
алашара ахыҵхырҭа убоит. уахьынтәиԥлакгьы,	и ты увидишь источник света. из любой точки будешь смотреть,
уара иубоит ауаа зегьы ишырбо еиԥш, –	ты увидишь то же самое так же, как и все люди, –
алашара хыҵхырҭак аҳасабала. иџьашьахәу формулоуп.	один источник общий. поразительная метафора.
абри аҩыза абзазаратә ҿырԥштәала акрызҵазкуа аформула ааирԥшит,	так просто, на бытовом уровне такую великую формулу объяснил,
иагьирҵабыргит азеиԥш хьышьҭра шыҟоу. ари шаноуп,	что есть общий источник. это поразительное дело,
уаҩԥсык иаҳасабала сарлахҿыхуеит, еснагь иҟало акы	ободряющее меня, как человека, что я приобщен к тому,
саргьы сахьалахәу азы.	что будет всегда.
уи алашара ақәгара, мамзаргьы арцәара ауӡом.	и этот свет нельзя убрать и погасить.
уара уи ахыҵхырҭа уатәызар,	если ты прилежишь к этому началу,
уԥсҭазаараҿы зегьы иашахаҭоуп.	то все правильно в твоей жизни.
абри аҩыза ақәгәыӷра сызирхынҳәит саргьы.	вот эту уверенность он мне тоже вернул.
сара арахь сҩыза иахь ауп сахьаауаз, апандемиа аныҟала дсымбацызт,	хотя, я сюда ехал к другу своему, началась пандемия,
ишҟагьы сзаауамызт, ара цәыббразы аҳәаа аадыртаанӡа,	и долго я не мог к нему попасть, пока здесь не открыли в сентябре,
усҟан ауп санааи, сахьааизгьы ыцхыраара ду сауит.	я только тогда смог приехать, и здесь я нашел мощную поддержку.
санаауаз, сҭагылазаашьа хьанҭан.	я уезжал оттуда в очень тяжелом состоянии.
сара еснагь схы сазҵаауан,	я всегда спрашивал себя,
избан сырҿиара акалашәа изыҟоу?	почему у меня творчество такое странное?
избан арационалра зсылам? издыруеит, гәыԥҩык ашәҟәыҩҩцәа ирҳәақәо,	почему я не рационален? я знал, что многие писатели говорят,
материал гәарҭак ҭысҵааит, акырӡа сгәы иҭасыҩхьеит ҳәа.	я гору материала изучил, столько всего выписывал в сердце.
толстоигьы ирацәаны аматериал ҭиҵаауан. еилырганы аматериал рацәоуп.	даже толстой много изучал материала.
сара, иахьысҳәо сацәыԥхашьоит аха, акгьы ҭысҵааӡомызт. сара исымоуп ароман дуқәа, иаҳҳәап « абна- аб » еиԥш иҟоу,	а я, к стыду своему, ничего не изучал. у меня есть большие романы такие, как « отец- лес »,
аметафизикатә планԥшра змоу, иаҳҳәап « џьанаҭ агәырӷьарақәа »,	большие романы метафизического плана, как « радости рая »,
« иона адгьылбжьаха ».	« остров ионы ».
шәара шәҟны урҭ рыӡбахә аӡәгьы имаҳац,	у вас тут никто даже не слышал о них,
избанзар, арҭ ашәҟәқәа ҭыҵит, аха аԥхьаҩцәа иргахьеит.	потому что эти книги у меня изданы, но они не разошлись.
убри аҟынтә, сара уи аҩыза аметод сымоуп анысҳәо,	поэтому, когда я говорил о том, что у меня такой метод, то
москва аӡәырҩы ргәы сзыԥжәон.	многие в москве сердились на меня.
зны ааԥхьара сырҭит ажәларқәа реиҩызара ауниверситет ашҟа,	однажды меня пригласили в университет дружбы народов,
уаҟа иаахтны исҳәеит ахаангьы аматериал шҭысымҵаауа,	и я там посмел признаться, что я никогда не изучаю материалы,
зҽызыԥсахуа ахдырра ала аҭагылазаашьа сҽақәыршәаны ишызыҩуа атәы,	что я пишу сразу в состоянии измененного сознания,
сроман ду аҿы шаҟа персонажцәа ҟало шысзымдыруагьы.	я не знаю сколько у меня будет персонажей в моем большом романе.
афранцыз еиҭагаҩцәа ирыԥхьаӡеит,	переводчики французские посчитали,
сроман « аб- абна » аҟны 500 ҩык инареиҳаны аперсонажцәа шалоу.	что в моем романе « отец- лес » 500 с лишним персонажей.
хаҭала сара исыздыруамызт аперсонажцәа шаҟаҩы ыҟаз, ус ауп сара аус шызуаз.	я даже не знал сколько у меня персонажей, то есть я работал именно вот так.
ахыҵхырҭа аҿаԥхьа сыҽкажьны аус зуан,	я работал, припадая к источнику,
уи атәы урыстәыла исызҳәомызт, аха ажәларқәа реиҩызара ауниверситет аҟны ианысҳәа,	и в этом я даже не мог признаться в россии, когда я сказал об этом в университете дружбы народов,
зҽаԥсазтәыз профессорк, кафедрак анапхгаҩы,	одна заслуженный профессор, чуть ли не зам. зав. кафедры чего- то
лгәы сзыԥжәеит:	на меня рассердилась:
« зыхдырра аҽаԥсахуа аҭагылазаашьа шәҽақәыршәаны аус жәуазар, уа шәыҟаз » лҳәеит.	« ну, если вы работаете в состоянии измененного сознания, оставайтесь там ».
сара лҿаԥхьа аҭамзаара шьҭасҵеит, иҟасҵари, слахьынҵа ус иҟоуп сҳәеит.	я перед ней извинился, сказал, ну, что делать, такова моя судьба.
сара араҟа исоуит сырҿиара зырҵабыргуа,	я здесь получил подтверждение своему творчеству,
ахыҵхырҭа сахьалахәу зҳәо. иаӷан имыҩуеи, ауаа ахьыҟазаалакгьы,	что я приобщен к источнику. яган же пишет, что люди где бы они ни были,
ахыҵхырҭа иалахәызар ҟалоит, хаҭала урҭ зынӡа еиԥшымзаргьы.	если они приобщены к источнику, они могут совершенно быть разными.
ара раԥхьаӡа ахәыцра салагеит,	тут я впервые стал размышлять,
сҩызцәа рызҵаара сҽазыскит,	стал спрашивать у своих друзей,
