в период холокоста в германии и на оккупированных нацистами территориях проживало приблизительно 35 000 свидетелей иеговы. около 1 500 из них погибло. причины их смерти установлены не во всех случаях. эта тема до сих пор изучается, поэтому цифры и другие факты могут обновляться.	германиа ахолокост аан анацистцәа ирымпыҵархалаз аҭыԥқәа рҿы иқәынхон 35 000- ҩык раҟара иегова ишаҳаҭцәа. урҭ рҟынтә 1 500- ҩык раҟара ҭахеит. шьоукы рыԥсышьа амзызқәа еилкааӡам. ари атема иахьа уажәраанӡагьы иҭырҵаауеит, убри аҟынтә ахыԥхьаӡареи егьырҭ афактқәеи рҽырыԥсахлар алшоит.
в следующий раз. как бог отвечает на наши молитвы?	анаҩстәи аан. ишԥаҟаиҵо анцәа ҳаҳәарақәа рҭак?
в следующий раз. как выразить благодарность за искупительную жертву иисуса?	анаҩстәи аан. ишԥааҳарԥшуеи аџьшьара иисус иҿыхратә ԥсхҭынҵаразы?
в следующий раз. когда царство бога начнет править землей?	анаҩстәи аан. ианбалаго анцәа иаҳра адгьыл аҿы напхгара аура?
в следующий раз. о чем можно молиться?	анаҩстәи аан. ҳзызиҳәалар ҳалшозеи анцәа?
в следующий раз. почему иисус должен был умереть?	анаҩстәи аан. избан христос дыԥсыр закәыз?
в следующий раз. что происходит после смерти?	анаҩстәи аан. иҟалозеи ауаҩы данԥслак ашьҭахь?
« в твои руки вверяю мой дух »	« сыԥсы унапы ианысҵоит »
в чем зимри и другие убеждали иамина?	зыгәра идыргози иамин зимрии егьырҭ ахацәеи?
в чем польза физических упражнений?	иамоузеи хәарҭас абаҩрҵәыра?
в чем проявляется смирение главы семьи?	иааирԥшлар шԥаилшо аҭаацәара ахада ахынраалара шилоу?
в чем разница между дружелюбием и дружбой?	излеиԥшымзеи ауаҩы қьиарала изыҟазаареи иҩызахареи?
в чем сходство между супружеской изменой и идолопоклонством?	еицырзеиԥшузеи ахатә ҩыза иԥсахреи амцмҵахырхәареи?
« вера в бога »	« анцәа дшыҟоу агәра агара »
видел ли кто- нибудь бога?	дибахьоума аӡәыр анцәа?
влияние на беременность. у курящих матерей дети чаще рождаются недоношенными, с низким весом или с такими пороками развития, как расщелина губы. кроме того, эти дети подвержены сердечно- сосудистым заболеваниям и могут умереть от синдрома внезапной детской смерти.	ахшараиура иазыԥшу ишырныруа. аҭаҭын иахо ахшараиура иазыԥшу аҳәса лассы- лассы ироураны иҟоу ахәыҷқәа раамҭа ааиаанӡа ииуеит, рыкапан маҷуп, насгьы аграқәа рымоуп. уи адагьы урҭ ахәыҷқәа агәы ачымазарақәа роуеит, насгьы иаалырҟьаны иԥсыр алшоит.
внять предостережению друга?	ариашара адкылара?
« во всем сохраняю стойкость »	« иарбан гәаҟразаалакь ахгара сазхиоуп »
во что верят свидетели иеговы?	зыгәра ргозеи иегова ишаҳаҭцәа?
вопрос. как справиться с болью утраты?	азҵаара. ишԥаҳалшо иаҳзааигәоу ауаҩы иԥсра ахьаа ахгара?
кем был иисус христос?	дызусҭадаз иисус христос?
о чем можно молиться?	ҳзызиҳәалар ҳалшозеи анцәа?
почему иисус должен был умереть?	избан христос дыԥсыр закәыз?
слушает ли бог молитвы?	дырзыӡырҩуама анцәа ҳаҳәарақәа?
что происходит после смерти?	иҟалозеи ауаҩы данԥслак ашьҭахь?
что такое царство бога?	изакәызеи анцәа иаҳра?
вот некоторые причины:	абар мзызқәак:
вот что тебе нужно:	абар уара иуҭаху:
« всегда готовы сохранять нейтралитет »	« анеитралитет ахьчара еснагь иазхиоуп »
всегда радуйтесь!	еснагь шәгәырӷьала!
вы важны для собрания иеговы!	аизараҿы инашәыгӡо аус иегова изы ахә ҳаракуп!
вывод. не позволяй сверстникам заставить тебя опустить планку своих нравственных принципов.	алкаа. уқәлацәа узықәныҟәо апринципқәа реилагара удырцалартә алумыршан.
газетное объявление о речи « миллионы теперь живущих никогда не умрут »	ажәахә « миллионы теперь живущих никогда не умрут » иазку аӡыргара агазеҭ аҿы
где они погибли?	иабаҭахеи дара?
глава 19. берегите дружбу с иеговой	ахы 19. иеговеи шәареи шәеиҩызара ахә шәшьала
будь честным во всём	иҟауҵозаалак ламысцқьарала ухы мҩаԥгала
как выбирать развлечения	ихәарҭоу агәырҿыхагақәа шалхтәу
как правильно поклоняться богу?	ишәыцхраар алшозеи ииашоу адинхаҵара аԥшаара?
как стать другом бога?	ишԥашәылшо анцәеи шәареи шәеиҩызцәахар?
кто такой бог?	дызусҭада анцәа?
кто такой иисус христос?	дызусҭада иисус христос?
любовь бога длится вечно	иаазырԥшуазеи анцәа иахь абзиабара
оставайся в любви бога	уҽырӷәӷәала иԥшьоу угәрахаҵара шьаҭас иҟаҵаны
после свадьбы	аҭаацәалазаара зегьы пату рзақәзааит
почему в мире так много зла?	избан адунеи гәаҟрала изҭәу?
почему нужно уважать власть?	избан амчра пату зақәҵалатәу?
правда об ангелах и демонах	амаалықьцәеи адемонцәеи ирызку аиаша
противостой дьяволу	шәырҿагыл аџьныши игьангьашу иусқәеи
пусть работа приносит тебе радость	уџьа алҵшәа бзиақәа агәахәара узааргалааит
« убегайте от блуда »	« акалҭбааԥсра шәхы ацәышәыхьча »
цените дар жизни	ҳамҭас ишәыҭоу аԥсҭазаара ахә ҳаракны ишәшьала
что бог хочет сделать для людей?	игәы иҭеикзеи анцәа ауаа рзы?
что будет с этим миром?	иааигәоума адунеи аҵыхәтәа?
что нужно для семейного счастья	шәҭаацәара насыԥ амазар алшоит
что происходит с человеком после смерти?	иабаҟоу иԥсхьоу ауаа?
что такое царство бога?	изакәызеи анцәа иаҳра?
« глубокое личное изучение помогает твердо держаться слова бога »	« иҵаулоу хаҭалатәи аҭҵаара анцәа иажәа ақәныҟәара иҳацхраауеит »
говорится ли в библии об использовании марихуаны и других наркотиков ради удовольствия?	ианума абиблиаҿы амарихуанеи егьырҭ анаркотик маҭәашьарқәеи агәахәаразы рыдкылара атәы?
говорить с иеговой, каждый день молясь ему	есыҽны анцәа диҳәалароуп, убас ала иара иегова диацәажәалоит
готов ли ты к празднованию вечери?	уазхиоума ахәылԥаз азгәаҭара?
готовы ли вы и дальше исправляться?	шәазхиоума шәара анаҩсгьы аҽыԥсахра?
готовы ли вы стать « ловцами людей »?	шәазхиоума шәара « уаакцәаҩны » аҟалара?
« для бога каждая жизнь драгоценна »	« анцәа изы дарбанзаалак ауаҩы иԥсҭазаара ахә ҳаракуп »
для иеговы жизнь человека драгоценна. как нам развить такое же отношение к дару жизни?	иегова изы ауаҩы иԥсҭазаара ахә ҳаракуп. ишԥаҳалшо ҳаргьы аԥсҭазаарахь убри аҩыза ахәаԥшышьа аизырҳара?
« для чего бог создал землю? »	« изишазеи анцәа адгьыл? »
дружба с иеговой никогда не закончится!	иеговеи уареи шәеиҩызара ахаангьы инҵәаӡом!
если вы хотите сделать пожертвование, зайдите на donate.jw.org.	хатәгәаԥхарала аҭара ҟашәҵар шәҭахызар, асаит donate.jw.org шәҭал.
если изучающий не растет духовно, откровенно, но по- доброму поговорить с ним	деизымҳауазар, ирҟәымшәышәны, аха иаартны шәиацәажәа
если у вас остались вопросы о верованиях свидетелей иеговы, больше информации вы можете получить на нашем сайте, в одном из наших филиалов, на встрече в ближайшем к вам зале царства и в личной беседе с кем- то из свидетелей иеговы, живущих в вашей местности.	иегова ишаҳаҭцәа рҵарақәа ирызкны азҵаарақәа шәзынхазар, еиҳаны еилышәкаар шәылшоит ҳсаит аҿы, ҳфилиалқәа руак аҿы, шәааигәара иҟоу аҳратә зал аҿы, мамзаргьы шәара шәҭыԥ аҿы инхо иегова ишаҳаҭцәа руаӡәк шәиацәажәар шәылшоит.
если человеку интересно. почему иисус должен был умереть?	ауаҩы аинтерес имазар. избан христос дыԥсыр закәыз?
есть ли у бога имя?	имоума анцәа ахьӡ?
за что братья хвалили сергея?	избан аишьцәа сергеи дыздырҽхәоз?
за что нас могут хвалить?	ҳаздырҽхәар алшозеи ҳара?
за что ты любишь иегову?	бзиа дзубозеи иегова?
заблуждение. в библейские времена сжигали тела только неугодных богу людей.	ииашам агәаанагара. абиблиатә аамҭақәа раан анцәа изымӡырҩуаз ауаа ракәын ирбылуаз.
зачем нам нужно следовать по стопам иисуса?	избан иисус ишьҭа ҳхыланы ҳцалар закәу?
знаете ли вы?	ижәдыруама шәара?
« знакомство с евангелием от матфея »	« матфеи иҟынтә аевангелие ахҳәаа »
« иегова бог поможет тебе »	« анцәа иегова уара дуцхраауеит »
« иегова всегда помнил обо мне »	« иегова сихамышҭӡеит »
« иегова даст ».	« иегова исиҭоит ».
иегова дорожит вами!	иегова шәыхә ҳаракны ишьоит!
иегова с радостью проявляет к нам милосердие.	иегова ҳара ҳахь агәшаҭара аарԥшра игәаԥхоит.
« иегова там ».	« иегова уа дыҟоуп ».
из чего будет видно, что преданность иегове для нас важнее привязанности к родным?	излоубарҭахозеи иегова иахь азиашара ҳара ҳзы еиҳа ишхадоу, ҳҭынхацәа рахь иҳамоу ацәаныррақәа раасҭа?
изменить свой образ мышления и поведение?	ҳхәыцшьеи ҳхымҩаԥгашьеи рыԥсахра?
израильский лагерь: уроки для нас	израильтәи алагерь: ҳара ҳзы аурокқәа
имена изменены.	хьыӡқәак ԥсахуп.
имя изменено.	ахьӡ ԥсахуп.
интересуйся успехами этих братьев и заверяй их в том, что у них все получится.	урҭ аишьцәа урыдҵаалала, насгьы ирыду шырзынагӡо агәра дыргала.
исповедование своей веры. несмотря на то что власти запретили свидетелям иеговы исповедовать их веру, те не прекращали.	рыгәрахаҵара атәы аҳәара. иегова ишаҳаҭцәа рыгәрахаҵара атәы аҳәара мап шацәкызгьы, дара аҟәыҵӡомызт.
исполняя почетные обязанности в организации иеговы?	иегова иорганизациаҿы аҭакԥхықәрақәа анынашәыгӡо?
история современных служителей иеговы ясно показывает, что он по- прежнему ведет и защищает свой народ. именно этой теме посвящена выставка « народ во имя иеговы » во всемирном главном управлении.	ҳаамҭазы инхо иегова имаҵзуҩцәа рҭоурых еилыкка иаҳнарбоит иара иахьагьы ижәлар дышрыцу, насгьы дышрыцхраауа. абри атема ауп изызку адунеизегьтәи ихадоу аусбарҭаҿы иҟоу « иегова ихьӡ зху ажәлар » захьӡу ацәыргақәҵа.
кажется, ваш ребенок позабыл про школу, потерял интерес к учебе и делает уроки спустя рукава. в итоге его оценки и поведение оставляют желать лучшего. как помочь ребенку повысить успеваемость?	иҟалап ахәыҷы ашкол хьаас имамзар, аҵарахьы аинтерес ицәыӡзар, насгьы аурокқәа ишабалак иҟаиҵозар. убри иахҟьаны ихәшьарақәеи ихымҩаԥгашьеи ҽеимзар ауеит. ишԥашәылшо шәхәыҷы ихәшьарақәа реиӷьтәра шәицхраар?
как 1 петра 5:5 помогает нам быть смиренными и скромными?	ишԥаҳацхраауеи 1 пиотр 5:5 иану ахынраалареи ахӡырымгареи аарԥшра?
как братья и сестры проявили любовь к делегатам международных конгрессов 2019 года?	ишԥаадырԥши аишьцәеи аиҳәшьцәеи абзиабара 2019 шықәсазтәи жәларбжьаратәи аконгресс иаҭааз рахь?
как будет проходить воскресение?	ишԥаҟало аԥсҭалара?
как бы вы ответили?	шәгәы ишԥаанаго?
как в древнем израиле все было хорошо организовано, так и сегодня в народе бога царит порядок. при этом у иеговы к каждому индивидуальный подход, и он ценит усилия каждого из нас.	ажәытәан израильаа рыбжьара аиҿкаара шыҟаз еиԥш, иахьагьы анцәа ижәлар рыбжьара аиҿкаара ыҟоуп. убри аамҭазгьы иегова хаҭала зегьы иҟаҳҵо ибоит, насгьы уи ахә ишьоит.
« как воскресают мертвые? »	« аԥсцәа рыԥсы злаҭалоузеи? »
как воспитать самодисциплину?	аиҿкаара аҽаршьцылара?
как выразить свою любовь к братьям и сестрам?	иааҳарԥшлар шԥаҳалшо аишьцәеи аиҳәшьцәеи бзиа ишаҳбо?
как древняя надпись подтверждает достоверность библии?	ишԥашьақәнарӷәӷәо ажәытә напынҵамҭа абиблиа агәра агара ишаԥсоу?
как другие в собрании могут помочь тебе служить иегове?	иуцхраар шԥарылшо аизараҿы аишьцәеи аиҳәшьцәеи иегова имаҵ аура?
как еще иегова нас защищает?	ҳашԥеихьчо иегова иҵегьы?
как еще ты мог бы подготовиться?	ишԥаулшо иҵегьы аҽазыҟаҵара?
как иегова в этих непростых обстоятельствах помог брату михайлову дать свидетельство другим заключенным?	дышԥаицхрааи иегова ҳашьа иҭагылазаашьақәа шымариамызгьы ицҭакыз шаҳаҭра рыҭара?
как иегова вас защищает?	ҳашԥеихьчо ҳара иегова?
как иегова вознаградил их?	дышԥарзылԥхеи урҭ иегова?
как иегова помог брату перенести эти испытания?	дышԥаицхрааи иегова дмитри аԥышәарақәа рыхгара?
как испытывалось послушание возвещателей, когда им сказали перейти в другое собрание?	ишԥаԥышәаз ажәабжьҳәаҩцәа иаадырԥшуаз аӡырҩра, даҽа еизарак ахь ишиастәу анрарҳәа?
как крохотные колибри проявляют мужество?	ишԥаадырԥшуеи агәымшәара аколибри хәыҷқәа?
как лошадей готовят к бою?	ишԥазыҟарҵо аҽқәа аибашьра?
как львицы защищают своих детенышей?	ишԥарыхьчо алымқәа- анацәа рхәыҷқәа?
как могут помочь добровольцы?	ацхыраара ҟарҵар шԥарылшо хатәгәаԥхарала амаҵ аура зҭаху?
как можно « увидеть » бога сейчас	уажәы анцәа « ибара » шҳалшо
как можно уделять внимание сестрам?	хәарҭас ирзаанагозеи ҳаҳәшьцәа ҳаамҭа ахьырзаҳкуа?
как можно укрепить уверенность в истинности своих убеждений?	ишԥашәылшо абиблиа иану шҵабыргу агәра жәгар?
как мы можем брать пример с авраама?	ишԥаҳалшо авраам иҿыԥшра?
как мы можем во всем поддерживать верного и благоразумного раба?	ишԥаҳалшо зегь рыла игәрагоу иҟәышу атәы ицхраара?
как мы можем проявлять нежность и теплоту?	иааҳарԥшлар шԥаҳалшо абзиабара?
как надежда на воскресение помогает нам, когда мы сталкиваемся с трудностями?	ишԥаҳацхраауеи аԥсҭалара агәра ахьаҳго, ҳаԥсҭазаара ашәарҭара ианҭагыло?
как нам нужно относиться к сестрам?	ҳарзыҟазар шԥаҳахәҭоу аиҳәшьцәа?
как нам помогают иисус и ангелы?	ишԥаҳацхраауеи иисуси амаалықьцәеи?
как нита с помощью вопросов побудила джейд размышлять?	ишԥалылшеи нита азҵаарақәа рыла џьеид ахәыцра лгәазҭаҵара?
как нита с помощью вопросов проявила к джейд личное внимание?	ишԥаалырԥши нита џьеид лахь аинтерес?
как нужно относиться к окружающим.	егьырҭ ҳарзыҟазар шҳахәҭоу.
как нужно относиться к помазанникам?	ҳарзыҟазар шԥаҳахәҭоу доуҳала иалху ақьырсианцәа?
как нужно поступить, если высказывания о других становятся саркастичными и недобрыми?	ҳхы мҩаԥаҳгар шԥаҳахәҭоу, егьырҭ рыхцәажәара аҵәы алхреи ақьиара знымԥшуа ажәақәеи рахь ииасуазар?
как они погибли?	ишԥаҭахеи дара?
как перестать видеть все в мрачном свете?	ишԥасылшо иҽеим ахәыцра аҽацәыхьчара?
как побудить изучающего посещать встречи собрания?	игәазҭаҳҵар шԥаҳалшо абиблиа зҳарҵо аизарақәа рахь аныҟәара?
как повысить успеваемость?	ишԥасылшо ашкол аҿы сеихьӡарақәа еиӷьыстәыр?
как поддерживать изучающих библию, которые приходят на встречи собрания?	абиблиа зҵо, насгьы аизарақәа рахь иныҟәо ргәы шьҭаҳхлар?
как полюбить занятия спортом?	ишԥасылшо абаҩрҵәыра аҟаҵара сҽасыршьцылар?
как помогать друг другу оставаться в истине?	ҳаицхыраалар шԥаҳалшо аҵабырг мҩала ацара?
как помочь изучающим библию полюбить иегову?	ишԥаҳалшо абиблиа зҳарҵо иегова иахь абзиабара аизырҳара ҳрыцхраар?
как помочь изучающим библию соблюдать повеления иисуса?	абиблиа зҳарҵо христос иԥҟарақәа рынагӡара ҳрыцхраар?
как помочь изучающим найти друзей в собрании?	ҳрыцхраар шԥаҳалшо абиблиа зҳарҵо аизараҿы аҩызцәа рыԥшаара?
как помочь неактивным братьям и сестрам возобновить служение?	ажәабжьҳәара иаҟәыҵыз ҳашьцәеи ҳаҳәшьцәеи ҩаԥхьа уи аҽалархәра ҳрыцхраар?
как поступок одного человека может многое изменить?	иалшома аӡәы заҵәык ихымҩаԥгашьа аҭагылазаашьа аԥсахыр?
как пример этих сестер воодушевил других?	ргәы зызҭанаҵазеи арҭ аиҳәшьцәа рҿырԥштәы егьырҭ?
