за что мы благодарны иегове?	избан ҳара иегова иҭабуп ҳәа зиаҳҳәо?
к какому выводу пришли тысячи братьев и сестер на конгрессе 1935 года и почему?	еилыркаазеи аишьцәеи аиҳәшьцәеи аӡәырҩы 1935 шықәсазы имҩаԥысыз аконгресс аҿы?
как благодаря воозу ноеминь и руфь обрели радость?	ишԥаиргәырӷьеи вооз ноемини руфи?
как вас ободряет пример юных христиан?	шәгәы шԥашьҭырхуеи шәеизараҿы иҟоу аҿар?
как иегова помог павлу через аристарха и луку?	дышԥаицхрааи иегова павел аристархи лукеи рыла?
как иегова руководит своей организацией? приведите примеры.	напхгара шԥаиҭо иегова иахьа иорганизациа? иаажәга аҿырԥштәқәа.
как можно ненароком обескуражить не состоящих в браке христиан?	ргәы дзырхьыр алшозеи аҭаацәара иалам ақьырсианцәа?
как пример иеговы учит нас делиться с другими своими обязанностями?	иҿаҳҵаар ҳалшозеи жәҩантәи ҳаб?
как родители могут помогать детям быть в истине?	иҟарҵар рылшозеи аҭаацәа рхәыҷқәа аҵабырг ахаангьы иаанырмыжьырц азы?
как святой дух помогал последователям иисуса?	ишԥарыцхраауаз иԥшьоу адоуҳа иисус иҵаҩцәа?
какая прекрасная надежда есть у служителей иеговы?	изықәгәыӷуазеи иегова имаҵзуҩцәа?
какими методами проповеди пользовалась организация иеговы в прошлом и какими пользуется сейчас?	иарбан методқәоу рхы иадырхәоз иегова иорганизациаҿы ауаа зегьы ажәабжь бзиа рыладырҵәаларц азы?
какое отношение слова из экклезиаста 11:6 имеют к проповеди благой вести о царстве?	ишԥадҳәалоу екклезиаст 11:6 иану ажәабжьҳәаратә ус?
какой у нас должен быть настрой?	ҳзызхиазар ҳахәҭоузеи ҳара?
какой урок павел никогда не забывал?	ихаимыршҭуази павел ахаангьы?
кто может помочь изучающему библию вырасти духовно и принять решение креститься?	ицхраауада ауаҩы доуҳала аизҳара?
от каких жизненных трудностей иегова не стал ограждать своего сына?	дызцәимыхьчазеи иегова иԥа?
почему библейские истины так ценны?	избан абиблиа иану аҵабыргқәа рыхә зыҳараку?
почему всех христиан должно интересовать небесное воскресение?	избан ақьырсианцәа зегьы жәҩантәи аԥсҭалара аинтерес рымазар зрыхәҭоу?
почему именно сейчас так важно проповедовать?	иарбан иҷыдоу мзызу ажәабжь аҳәаразы иҳамоу?
почему мир ненавидит последователей иисуса?	избан ауаа ҳзырцәымӷу?
почему нам важно развеивать свои сомнения?	избан иҳазцәырҵуа алакҩакрақәа ҳаӡбалар закәу?
почему нам нужно радушно приветствовать изучающих библию на наших встречах?	избан аизарақәа рахь аныҟәара иалаго ауаа гәыкала ҳарԥылалар зҳахәҭоу?
почему наша вера становится крепче в испытаниях?	ишԥаныруеи аԥышәарақәа ҳагәрахаҵара?
чему вас учат слова марли и бенджамина?	ишәнарҵозеи марлии бенџьамини рҿырԥштәы?
чему вас учит пример аристотелиса и элени апостолидис?	ишәдырҵозеи аиашьа аристотелис иԥҳәыси иареи рҿырԥштәы?
чему вас учит пример ясмин?	иаҳнарҵозеи иасмин лҿырԥштәы?
что поможет нам получать радость от служения, даже если люди не интересуются благой вестью?	ишәыцхраар алшозеи амаҵзура аҟынтә агәырӷьара аиура, ауаа уиаҟара имӡырҩуазаргьы?
что произошло с иосифом в юности?	дзықәшәазеи иқәыԥшыз иосиф?
что происходило в день казни иисуса?	изеиԥшрази аҭагылазаашьа иисус аҵыхәтәантәи иажәақәа аниҳәоз?
биография. иегова сделал мои пути прямыми	абиографиа. иегова сымҩа ириашоит
биография. « сейчас я не мыслю себя без служения! »	абиографиа. « уажәшьҭа ажәабжьҳәара бзиа избоит! »
благодаря чему ваши молитвы на изучении библии будут конкретными?	иҟашәҵар шәылшозеи шәынцәаиҳәара ауаҩы игәаҵанӡа инеирц азы?
благодаря чему можно оживить библейский рассказ?	иҟаҳҵалар ҳахәҭоузеи абиблиаҿы ҳзыԥхьо ҳгәаҵанӡа инеиларц азы?
будьте сильными! укрепляйте свою веру	шәҽырӷәӷәаны шәыҟаз! шәыгәрахаҵара шәырӷәӷәала
в достоверности каких основополагающих истин вам нужно убедиться?	иарбан ихадоу ҵабыргқәоу зыгәра ганы шәыҟазар шәыхәҭоу?
в каких ситуациях нужно вступаться за сестер? приведите пример.	ианбаҭаххар алшо аиаҳәшьа лыхьчара? иаажәга аҿырԥштәы.
в каких ситуациях сестрам может понадобиться наша помощь?	иарбан цхыраароу аиҳәшьцәа ирҭаххар алшо?
в какой ситуации находился павел?	иарбан уадаҩроу павел дызҭагылаз?
в каком случае друг может предостеречь вас?	ианбашәҭаххар алшо шәҩыза иҟынтә ариашара?
в каком случае евангелия по- настоящему нам помогут?	иҟаҳҵалар акәзеи аевангелиеқәа ирну хәарҭа ҳзааргаларц азы?
в любых обстоятельствах « имейте веру в бога »	еиуеиԥшым аҭагылазаашьақәа рҿы « анцәа ихаҵара шәымаз »
« в твои руки вверяю мой дух ».	« сыԥсы унапы ианысҵоит ».
в чем был уверен иисус, согласно луки 23:46?	зыгәраганы дыҟази иисус, лука 23:46 иану инақәыршәаны?
в чем был уверен иоанн?	зыгәра ганы дыҟази иоанн?
в чем еще выражалась любовь иоанна к братьям и сестрам?	ишԥааирԥши иоанн иашьцәеи иаҳәшьцәеи бзиа ишибоз?
в чем еще мы можем брать пример с иисуса?	ишԥаҳалшо уаҳа иисус иҿыԥшра?
в чем мы можем быть уверены?	зыгәра ганы ҳаҟазар ҳалшозеи ҳара?
в чем мы можем быть уверены, если не даем отдыха своей руке?	ҳаззыԥшызар ҳалшозеи ҳара, ҳнапы ԥсшьаха аҳамҭалар?
в чем нам нужно быть уверенными?	зыгәра ганы ҳаҟазар ҳахәҭоузеи ҳара?
в чем превосходство закона христа?	избан христос изакәанԥҟара еиҳа изеиӷьу?
в чем проявляется смирение иеговы?	ишԥааирԥшуеи иегова ахынраалара?
в чем проявлялась скромность даниила?	ишԥааирԥши даниил ахынраалара шилаз?
в чем проявлялось смирение иисуса?	ишԥааирԥшуаз иисус ахынраалара?
в чем синди находила радость во время тяжелой болезни?	илыцхраазеи синди агәырӷьара ахьчара?
воскресит ли бог адама? объясните.	иԥсы ҭеиҵома анцәа адам? иҳаилшәыркаа.
время от времени оценивать духовные успехи изучающего	аамҭа- аамҭала доуҳала деизҳауоу- деизымҳауоу гәашәҭала
всегда держите свой взор на иегове	иегова еснагь шәылаԥш иқәкыз
всегда ли иоанн относился к другим с любовью?	иааирԥшуазма иоанн еснагь абзиабара?
всей семьей служить подсобными пионерами, когда собрание посещает районный надзиратель	шәеизара араионтә хылаԥшҩы данаҭаауа, шәшынҭаацәоу ицхырааҩу пионерс амаҵ аура
вы важны для собрания иеговы!	аизараҿы инашәыгӡо аус иегова изы ахә ҳаракуп!
готовиться к каждому занятию	еснагь абиблиатә ҵара иҽазыҟаиҵалароуп
готовы ли вы и дальше исправляться?	шәазхиоума шәара анаҩсгьы аҽыԥсахра?
готовы ли вы стать « ловцами людей »?	шәазхиоума шәара « уаакцәаҩны » аҟалара?
давать слово библии	абиблиа ацәажәаразы алшара ашәҭ
дело подготовки учеников приносит радость братьям во всем мире	аҵаҩцәа разыҟаҵара аус адунеи зегь аҿы аишьцәа агәырӷьара рзаанагоит
зачем аса укреплял свое войско?	избан аса ир зирӷәӷәоз?
знаете ли вы? как древняя надпись подтверждает достоверность библии?	ижәдыруама шәара? ишԥашьақәнарӷәӷәо ажәытә напынҵамҭа абиблиа агәра агара ишаԥсоу?
из- за чего мы можем пасть духом? что мы обсудим в этой статье?	избан ҳгәы каҳар залшо? еилҳаргозеи ари астатиаҿы?
из- за чего нас может охватить тревога?	иҟалар алшозеи агәҭынчымра ҳҽаҳҭар?
из- за чего один левит стал чувствовать себя подавленным?	избан алевитцәа иреиуаз аӡәы игәы зкаҳаз?
из- за чего петр мог чувствовать себя подавленным?	игәы казыжьуази пиотр?
изучать каждую неделю	абиблиа есымчыбжьа иҭиҵаалароуп
исполняйте закон христа, когда вас не видят другие	инашәыгӡала христос изакәанԥҟара, аӡәгьы шәанимбо
исполняйте закон христа, когда проповедуете	инашәыгӡала христос изакәанԥҟара, ажәабжь бзиа анышәҳәо
к чему вас побудила эта статья?	шәгәы зызҭанаҵазеи шәара ари астатиа?
к чему нас побуждают слова из 2 тимофею 4:1, 2?	ҳгәы зызҭанаҵозеи рҵаҩцәак раҳасабала 2 тимофеи иахь 4:1, 2 иану?
к чему побуждала иоанна любовь?	игәы зызҭанаҵози иоанн абзиабара?
каждый день общаться с иеговой	есыҽны иегова диацәажәалароуп
как анри справился с чувством подавленности?	ицхраазеи анри агәкаҳара аиааира?
как братья в россии пользовались периодом спокойствия?	рхы ишԥадырхәоз урыстәыла инхо ҳашьцәеи ҳаҳәшьцәеи аҭынчра аамҭа?
как братья и сестры в одной стране проявляли друг к другу любовь во время войны?	ишԥаадырԥшуаз аишьцәеи аиҳәшьцәеи бзиа ишеибабоз аибашьра ахьцоз тәылак аҿы?
как ваш пример может помочь изучающему и дальше расти духовно?	ицхраар шԥалшо ҳҿырԥшы абиблиа зҵо ауаҩы?
как ваше поведение может повлиять на изучающих библию?	инырыр шԥалшо ҳхымҩаԥгашьа абиблиа зҵо ауаҩы?
как вера побуждает нас проповедовать?	ишԥаҳацхраауеи ҳагәрахаҵара ажәабжь аҳәара?
как верные друзья помогают нам стать ближе к иегове?	ишԥаҳацхраауеи аҩызцәа бзиақәа иегова изааигәахара?
« как воскресают мертвые? »	« аԥсцәа рыԥсы злаҭалоузеи? »
как вы можете применить принцип из притч 20:18, когда вас приглашают на изучение библии?	ишԥашәылшо ажәамаанақәа 20:18 иану апринцип шәхы иашәырхәар, аӡәы абиблиатә ҵарахьы шәанааиԥхьо?
как глава семьи может заботиться об эмоциональных потребностях домашних?	ишԥаилшо аҭаацәара ахада иҭаацәа ремоциатә ҭахрақәа дышреиҷаҳауа ааирԥшыр?
как главы семей могут подражать смирению иеговы и иисуса?	ишԥарылшо аҭаацәара ахадацәа иеговеи иисуси ирҿыԥшны ахынраалара аарԥшра?
как готовиться к каждому занятию?	ишԥашәылшо абиблиатә ҵарақәа ибзианы рҽырзыҟаҵара?
как давид мог бы поступить в сложившейся ситуации?	ихы мҩаԥигар шԥалшоз давид дзықәшәаз ауадаҩраҿы?
как давид поступил в трудной ситуации?	ихы шԥамҩаԥигеи давид ауадаҩра данҭагыла?
как давиду помог иегова?	дышԥаицхрааи иегова давид?
как еще вы можете помочь изучающему библию почувствовать себя частью собрания?	иҟашәҵар шәылшозеи иҵегьы ауаҩы аизара дшахәҭаку ибарц азы?
как еще мы можем помогать сестрам?	иҟаҳҵалар ҳалшозеи уаҳа ҳаҳәшьцәа ҳрыцхрааларц азы?
как еще нам помогает иегова?	дышԥаҳацхраауеи иегова иҵегьы?
как иегова вас защищает?	ҳашԥеихьчо ҳара иегова?
как иегова и иисус проявляют к нам свою любовь?	ишԥаадырԥшуеи иеговеи иисуси ҳара ҳахь ирымоу абзиабара?
как иегова помог павлу?	дышԥаицхраауаз иегова павел?
как иегова помог павлу через иисуса?	дышԥаицхрааи иегова павел иисус ила?
как иегова помогал павлу через братьев и сестер?	дышԥаицхраауаз иегова павел аишьцәеи аиҳәшьцәеи рыла?
как иегова проявил терпение к аврааму и сарре?	ишԥааирԥши иегова ачҳара авраами сарреи рахь?
как иегова спасет свой народ во время великого бедствия?	ишԥеиқәирхо иегова ижәлар арыцҳара ду аан?
как иегова учит нас на примерах других людей?	аҵара шԥаҳирҵо иегова иажәа ала?
как иисус помог петру справиться с подавленностью?	дышԥаицхрааи иисус пиотр агәкаҳара аиааира?
как иосифа могли утешать его пророческие сны?	игәы шԥашьҭырхуаз иосиф иибахьаз аԥхыӡқәа?
как каждый из нас может восхвалять бога и христа на вечере воспоминания?	иааҳарԥшыр шԥаҳалшо ахәылԥаз аҿы иеговеи иисуси иаҳзыҟарҵаз ахә шаҳшьо?
как любовь к отцу укрепила иисуса?	излаицхраазеи иисус иаб иахь имаз абзиабара?
как многие люди одержат победу над смертью?	ишԥаиааиуеи аԥсра доуҳала иалху ақьырсианцәеи анцәа изиашоу егьырҭ ауааи?
как можно развивать свои учительские способности?	иҳацхраауазеи ҳмаҵзура аиӷьтәра?
как молодые братья могут помогать другим христианам?	ирыцхраалар шԥарылшо иқәыԥшу аишьцәа зықәрахь инеихьоу аишьцәеи аиҳәшьцәеи?
как мы можем ободрять сестер?	ишԥаҳалшо ҳаҳәшьцәа ргәы ашьҭыхра?
как мы можем поддерживать неактивных братьев и сестер?	идҳарбар шԥаҳалшо ихьшәашәаз ҳашьцәеи ҳаҳәшьцәеи ҳашрывагыло?
как на нас влияет смирение?	иҟаҳҵалозеи ахынраалара ҳалазар?
как на нас может влиять уныние?	изшәарҭоузеи агәкаҳара?
как нам нужно относиться к браку и безбрачию?	иаҳҳәар ҳалшозеи аҭаацәалазаареи аҭаацәаламзаареи ирызкны?
как нам помогает молитва?	ишԥаҳацхраауеи анцәаиҳәара?
как нам помогает слово бога?	иҳацхраар шԥалшо анцәа иажәа?
как нам помогают близкие отношения с иеговой?	хәарҭас иаҳзаанагозеи иеговеи ҳареи ҳаиҩызара ӷәӷәа?
как нам поможет уверенность в истинности библейских учений?	ишԥаҳацхраауеи абиблиа шьаҭас измоу ҳагәрахаҵара?
как научиться быть хорошим главой семьи?	ицхраауазеи ахаҵа аҭаацәараҿы хада бзианы аҟалара?
как некоторые мужчины относятся к женщинам?	ишԥарызныҟәо ахацәа шьоукы рыҳәса?
как нужно относиться к тому, что иегова все о нас знает?	иарбан цәаныррақәоу иҳазцәырҵлар ахәҭоу, иегова ибзиаӡаны ҳшидыруа ҳаназхәыцуа?
как о нас заботится организация иеговы?	дышԥаҳаиҷаҳауеи иегова иорганизациа ала?
как относились к давиду некоторые люди?	ишԥаизыҟаз шьоукы давид?
как оценить духовные успехи изучающего?	еилаҳкаар шԥаҳалшо ауаҩы доуҳала деизҳауоу- деизымҳауоу?
как павел мог бы поступить в сложившейся ситуации?	ихы мҩаԥигар шԥаилшоз павел?
как павел поступил в трудной ситуации?	иҟаиҵози павел ауадаҩра данҭагылаз?
как павлу помог правитель фест?	дышԥаицхрааи анапхгаҩы фест павел?
как побудить изучающего регулярно посещать встречи собрания?	иҟаҳҵар ҳалшозеи абиблиа зҳарҵо иааиԥмырҟьаӡакәа аизарақәа рахь аныҟәара игәазҭаҳҵарц азы?
как подготовить изучающего библию к крещению? что мы обсудим в следующей статье?	дышԥазыҟаҵатәу абиблиа зҳарҵо аҽӡаахра? еилҳаргозеи анаҩстәи астатиаҿы?
как помочь братьям и сестрам оставаться в истине?	иҟаҳҵалар ҳалшозеи ҳашьцәеи ҳаҳәшьцәеи аҵабырг мҩала ацара ҳрыцхрааларц азы?
как помочь изучающему развить близкие отношения с иеговой?	иҟашәҵар шәылшозеи абиблиа зшәырҵо иегова иҩызахара шәицхраарц азы?
как помочь изучающему узнать о качествах иеговы? приведите пример.	ҳицхраар шԥаҳалшо ауаҩы иегова дзеиԥш нцәоу аилкаара? иаажәга аҿырԥштәы.
как помочь изучающим развить желание проповедовать благую весть?	иргәаҳарԥхар шԥаҳалшо абиблиа зҳарҵо ажәабжь бзиа аиҭаҳәара?
как пример иисуса помогает нам помнить о важности дела проповеди?	ишԥаҳацхраауеи иисус иҿырԥшы ажәабжьҳәаратә ус зегь раԥхьа аргылара?
как проницательность помогла дэниелу?	ишԥаицхрааи дениел агәеилых бзиа?
как проявить заботу о неактивных братьях и сестрах?	иааҳарԥшыр шԥаҳалшо ихьшәашәаз ҳашьцәеи ҳаҳәшьцәеи ҳгәы ишыҵхо?
как ранние христиане пользовались периодом спокойствия?	рхы ишԥадырхәоз актәи ашәышықәсазы инхоз ақьырсианцәа аҭынчра аамҭа?
как реагировал давид на несправедливое отношение к нему царя саула?	иҟаиҵози давид аҳ саул ииашамкәа дышизныҟәозгьы?
как руфь заботилась о ноемини, согласно руфи 1:16, 17, 22?	лгәы шԥашьҭылхуаз руфь ноеминь, руфь 1:16, 17, 22 иану инақәыршәаны?
как с помощью собрания иегова помогает нам сохранять спокойствие и доверять ему?	ихы ишԥаирхәо иегова ҳашьцәеи ҳаҳәшьцәеи агәҭынчра ахьчареи игәра агареи дҳацхраарц азы?
как слова из 1 иоанна 1:9 помогают нам служить иегове с чистой совестью?	ишԥаҳацхраауеи 1 иоанн 1:9 иану ҳгәы рҭынчны иегова имаҵ аура?
как слова из иеремии 20:8, 9 учат нас бороться с подавленностью?	ишԥаҳацхраауеи иеремиа 20:8, 9 иану агәкаҳара аиааира?
