с каким препятствием сталкиваются юные христиане?	иарбан уадаҩроу иқәыԥшу ақьырсианцәа зықәшәо?
с какими еще трудностями сталкивались христиане в первом веке?	иарбан уадаҩрақәоу еиҭа актәи ашәышықәсазы инхоз ақьырсианцәа зықәшәоз?
с какими испытаниями могут встретиться служители иеговы?	иарбан уадаҩрақәоу иегова имаҵзуҩцәа зықәшәо?
с какими трудностями авраам сталкивался в семейной жизни?	иарбан уадаҩрақәоу авраам иҭаацәараҿы имаз?
с какими трудностями однажды столкнулся авраам?	дзықәшәазеи авраам зны?
с какими трудностями сталкивался павел?	иарбан уадаҩрақәоу павел дзықәшәоз?
с какой еще трудностью приходилось бороться давиду?	иарбан уадаҩроу давид еиҭа имаз?
с какой целью иоанн написал три своих письма?	избан иоанн х- саламшәҟәык зиҩыз?
с чем пришлось столкнуться некоторым братьям и сестрам?	иарбан уадаҩроу шьоукы зықәшәаз?
серия речей: иегова дает нам радость.	иегова агәырӷьара ҳаиҭоит.
серия речей: радуем иегову во всем	иегова зегь рыла дҳаргәырӷьоит
случаи из служения	амаҵзура аҟынтәи ахҭысқәа
становиться другом иеговы	иегова дизааигәахалароуп
« твердо стойте в вере. укрепляйтесь »	« ишәымоу агәрахаҵара шәазықәгылаз. шәыӷәӷәаз »
« ты будешь со мной в раю ».	« уара џьанаҭ усыцҟалоит ».
укреплять надежду	шәгәыӷра шәырӷәӷәала
учите других « любить имя иеговы »	идшәырҵала егьырҭ « иегова ихьӡ бзиа абара »
учить наизусть стихи из библии	абиблиатә жәеинраалақәа ҿырҳәала ишәҵала
учиться на примерах из прошлого	абиблиа иану аҿырԥштәқәа шәрызхәыцла
хорошо ли вы понимаете принцип главенства в собрании?	иарбан мчроу аизара аиҳабацәа ирымоу?
« храни доверенное тебе »	« угәы- уԥсы ирҭаҵәахны иумаз абри иуаҭәашьоу »
чего нам не стоит делать?	иҟаҳамҵалар акәзеи ҳара?
чего ожидают люди с земной надеждой?	изықәгәыӷлар рылшозеи адгьыл аҿы анхаразы агәыӷра змоу?
чего с нетерпением ожидает остаток помазанников?	иззыԥшузеи ргәы хыҭ- хыҭуа адгьыл аҿы иаанханы иҟоу доуҳала иалху ақьырсианцәа?
чего с нетерпением ожидают другие овцы?	ргәы хыҭ- хыҭуа иззыԥшузеи егьырҭ ауасақәа?
чей пример служит поддержкой для одной сестры?	лгәы шьҭызхуазеи аҭаацәара иалам иаҳәшьак?
чем давид отличался от саула?	излеиԥшымзи саули давиди?
чем нам может помочь 15- я глава первого письма коринфянам?	хәарҭас иаҳзаанагозеи 1 коринфаа рахь 15- тәи ахы?
чем нам полезен призыв павла?	ишԥаҳацхраауеи павел илабжьара?
чем нам полезен пример тех, кто не сохранял спокойствия и не доверял иегове?	избан агәҭынчра змыхьчоз, насгьы иегова иқәымгәыӷуаз рҿырԥштәқәа ҳрызхәыцлар зҳахәҭоу?
чем опасна ложь отступников?	избан аҵабырг иацәхьаҵыз рымц зшәарҭоу?
чем похожи помазанники и другие овцы?	излеиԥшузеи иԥшьоу адоуҳала иалху ақьырсианцәеи егьырҭ ауасақәеи?
чему богобоязненные родители могут научиться у иосифа и марии?	иднарҵар алшозеи ақьырсиантә ҭаацәа иосифи мариеи рҿырԥштәы?
чему вас учат примеры масаэ и томоё?	ишәнарҵозеи ҩыџьа аиҳәшьцәа рҿырԥштәы?
чему вас учит рассказ раджива?	ишәнарҵозеи шәара раџьив иҿырԥштәы?
чему жен учит пример иисуса?	иднарҵозеи аҳәса иисус иҿырԥштәы?
чему жены могут научиться на примере авигеи?	иднарҵозеи аҳәса авигеиа лҿырԥштәы?
чему жены могут научиться на примере марии?	иднарҵозеи аҳәса мариа лҿырԥштәы?
чему можно научиться на ошибках асы?	иаҳдырҵар алшозеи аса игхақәа?
чему мужья могут научиться на примере марии?	иднарҵозеи ахацәа мариа лҿырԥштәы?
чему нас могут научить слова карол?	иаҳнарҵозеи карол лҿырԥштәы?
чему нас научила эта статья?	еилаҳкаазеи ари астатиаҟынтә?
чему нас учат последние слова иисуса?	иаҳдырҵозеи иисус аҵыхәтәантәи иажәақәа?
чему нас учат слова иисуса, записанные в иоанна 5:19, 30?	иаҳнарҵозеи иисус иҿырԥштәы, иоанн 5:19, 30 иану инақәыршәаны?
чему нас учит пример ангелов?	иарбан ҿырԥшу амаалықьцәа иҳарҭо?
чему пример иеговы учит родителей и старейшин?	иднарҵозеи аҭаацәеи аизара аиҳабацәеи иегова иҿырԥшы?
чему юные христиане могут научиться у иисуса?	иднарҵар алшозеи ахәыҷқәа иисус иҿырԥштәы?
что было в основе веры христиан первого века?	шьаҭас иамази актәи ашәышықәсазы инхоз ақьырсианцәа рыгәрахаҵара?
что в 1 коринфянам 15:22 говорится о воскресении?	изҵанакуада 1 коринфаа рахь 15:22 иану ажәақәа?
что в библии говорится о дружбе?	ианузеи абиблиа аиҩызара иазкны?
что в иакова 5:11 говорится о глубине любви иеговы?	иҳаилнаркаауазеи иаков 5:11 иану иегова шаҟа бзиа ҳаибо иазкны?
что в откровении 7:11, 12 говорится о небесной семье иеговы?	иҳаилнаркаауазеи иегова жәҩантәи иҭаацәара иазкны аатра 7:11, 12 иану?
что важно принимать во внимание главе семьи?	ихеимыршҭуазеи аҭаацәара ахада бзиа?
что для иисуса было хуже самой казни?	зегь раасҭа еицәази иисус изы?
что еще доверил нам иегова?	иҳаҭәеишьазеи уаҳа иегова?
что еще нам нужно делать, чтобы обрести мудрость?	иҟаҳҵалар акәзеи иҵегьы, аҟәыӷара ҳаурц азы?
что еще побуждает нас проповедовать?	ҳгәазҭазҵозеи ажәабжь аҳәара?
что значит носить нагрудник праведности?	иаҳҳәар анбаҳалшо аиашара агәышԥыхьчага ҳшәуп ҳәа?
что значит обуть ноги в готовность проповедовать благую весть?	иаанагозеи ажәабжь бзиа аҳәара ҳазхиазарц азы ашьапымаҭәа ашьаҵара?
что значит проявлять стойкость?	иаанагозеи ахачҳара аарԥшра?
что значит следовать по стопам иисуса?	иаанагозеи иисус ишьҭа ухыланы ацара?
что значит следовать по чьим- то стопам?	иаанагозеи аӡә ишьҭа ухыланы ацара?
что иегова замечает в своих служителях?	иидыруазеи иегова имаҵзуҩцәа ирызкны?
что иисус повелел ангелам?	иарбан дҵоу иисус амаалықьцәа ириҭаз?
что иоанн говорил о любви?	дызлацәажәози иоанн ииҩуаз ашәҟәқәа рҿы?
что мешает некоторым христианам принимать помощь от других?	избан ацхыраара адкылара ҳцәыцәгьахар залшо?
что могло помешать дружбе ионафана с давидом?	иаԥырхагахар алшози ионафани давиди реиҩызара?
что может влиять на то, как мужья относятся к своей жене и детям?	ишԥарзыҟоу ахацәа шьоукы рыҳәсеи рхәыҷқәеи, насгьы избан?
что может помешать прислушаться к предостережению друга?	иԥырхагахар алшозеи ауаҩы иҩыза иҟынтә иоуа алабжьара бзиа адкылара?
что можно делать, чтобы более умело проповедовать и обучать других?	иҳацхраар алшозеи ажәабжьҳәаратә, насгьы арҵаратә ус аҿы ҳҟазара аиӷьтәра?
что можно сказать о наших юных братьях?	иаҳҳәар ҳалшозеи иқәыԥшу аишьцәа ирызкны?
что мы настроены делать?	ҳзызхиазар ҳахәҭоузеи ҳара?
что мы обсудим в следующей статье?	еилҳаргозеи анаҩстәи астатиаҿы?
что мы обсудим в этой статье?	еилҳаргозеи ари астатиаҿы абиблиатә ҵара шымҩаԥгалатәу иазкны?
что мы пожнем, если не ослабеем	ҳамчыдамхар, иҭаҳгало аҽаҩра
что мы понимаем под словом « истина »?	иаанагозеи ҳара ҳзы ажәа « аҵабырг »?
что мы рассмотрим в этой статье?	еилҳаргозеи ари астатиаҿы?
что мы узнаём о принципе главенства из 1 коринфянам 11:3?	еилаҳкаауазеи ахадара апринцип иазкны 1 коринфаа рахь 11:3 аҟынтә?
что нам нужно делать? что мы обсудим в следующей статье?	ҳзызхәыцлар ҳахәҭоузеи ҳара? еилҳаргозеи анаҩстәи астатиаҿы?
что нам обещает иегова, согласно исаии 41:10, 13?	ҳазқәиргәыӷуазеи иегова, исаиа 41:10, 13 иану инақәыршәаны?
что нужно включать в свои молитвы?	иаҳҳәалар ҳалшозеи иҵегьы анцәа ҳаниҳәо?
что нужно и дальше делать христианам после крещения?	иҟарҵалар рыхәҭоузеи зыҽӡаазххьоу ақьырсианцәа?
что нужно молитвенно обдумать главе семьи?	ибзианы дзызхәыцыр акәзеи аҭаацәара ахада?
что общего у глав семей и старейшин?	еицырзеиԥшузеи аҭаацәара ахадацәеи аизара аиҳабацәеи?
что открыто признавал апостол павел?	ииҳәози павел имӡакәа?
что помогало иосифу бороться с унынием?	ицхраазеи иосиф агәҭынчра ахьчара?
что помогло ае и хектору справиться со своими испытаниями?	ирыцхраазеи аиеи хектори ирымаз ауадаҩрақәа риааира?
что помогло апостолу павлу не испытывать чрезмерного чувства вины?	ицхраазеи павел мыцхәы ихы ахара адымҵара?
что помогло исангу справиться с потрясением после несчастного случая?	ицхраазеи исанг агәкаҳара аиааира?
что помогло одной сестре не тосковать по прошлому?	илыцхраазеи иаҳәшьак ииасхьаз мыцхәы агәхьаамгара?
что поможет вам пройти обучение в школе благовестников царства?	ишәыцхраар алшозеи аҳра ажәабжьҳәаҩцәа рышкол аҿы аҵара ахысра?
что поможет вам стать умелыми проповедниками и учителями благой вести?	иарбан ҟазшьақәоу ишәыцхраауа иисус иааԥхьара адкылара?
что поможет изучающему полюбить библейские истины?	ицхраар алшозеи абиблиа зшәырҵо абиблиатә ҵабырг бзиа абара?
что поможет изучающему расти духовно?	ицхраауазеи абиблиа зҳарҵо ауаҩы доуҳала аизҳара?
что поможет нам более умело пользоваться библией?	иҳацхраауазеи абиблиа еиҳа еиӷьны ахархәара?
что поможет нам воспитать самодисциплину?	иҳацхраар алшозеи иаҳцәыцәгьоу аусқәа рынагӡара?
что поможет нам не терять из виду важность дела проповеди?	ҳгәазҭазҵозеи ҳхы ҳамеигӡакәа ажәабжь аҳәара?
что поможет нам оживить рассказы из евангелий?	иҳацхраауазеи аевангелиеқәа рҿы ҳзыԥхьо аԥсы ахаҵара?
что поможет нам победить уныние?	иҳацхраауазеи агәкаҳара аиааира?
что поможет нам развить нежные чувства к братьям и сестрам?	иҳацхраауазеи ҳашьцәеи ҳаҳәшьцәеи рахь абзиабара аизырҳара?
что поможет нам сопротивляться искушению?	иҳацхраауазеи ҳхызхыр алшо аҿагылара?
что признавал апостол павел? что мы обсудим в этой статье?	ииҳәазеи апостол павел? еилҳаргозеи ари астатиаҿы?
что приносит сестрам радость?	ргәы шьҭызхуазеи аиҳәшьцәа?
что свидетельствует о порядке и мире в организации иеговы?	иаҳзырбозеи иегова иорганизациаҿы акзаареи аҭынчреи шыҟоу?
что сказал давид о смирении иеговы?	ииҳәазеи давид иегова ихынраалара иазкны?
что случилось в жизни ноемини и руфи?	изықәшәазеи ноемини руфи?
что, согласно иоанна 19:26, 27, иисус сказал марии и иоанну и почему?	иреиҳәазеи иисус мариеи иоанни, иоанн 19:26, 27 иану инақәыршәаны, насгьы избан?
что такое закон христа?	изакәызеи христос изакәанԥҟара?
что такое любовь к богу?	изакәызеи анцәа иахь абзиабара?
юноши и девушки, пусть иегова будет вашим лучшим другом	арԥарцәеи аҭыԥҳацәеи, иегова шәҩыза бзиа иакәзааит
юные братья, как вам завоевать доверие собрания?	иқәыԥшу аишьцәа, иҟашәҵар шәылшозеи шәара аишьцәеи аиҳәшьцәеи шәыгәра ргаларц азы?
а вы читали эту книгу?	шәаԥхьахьоума шәара ари ашәҟәы?
а как иегова может задействовать тебя?	ишԥаилшо иегова ихы уаирхәар?
а как ты мог бы проявлять любовь на конгрессе?	ишԥаулшо аконгресс аҿы абзиабара аарԥшра?
а что мешает тебе? эта причина сама собой не исчезнет, тебе придется потрудиться. но ты не пожалеешь!	иуԥырхагоузеи уара? уи амзыз ахала ицаӡом, уи азы аџьабаа батәуп. аха уи ахаан уахьхәӡом!
абзац 14. « джони и гидеон: были врагами, стали братьями »	абзац 14. « џьонии гедеони: еиӷацәан, аха еишьцәахеит »
абзац 5. « для бога каждая жизнь драгоценна »	абзац 5. « анцәа изы дарбанзаалак ауаҩы иԥсҭазаара ахә ҳаракуп »
активно работай в классе.	аурокқәа ибзианы ухы рылархәла.
акции и ценные бумаги,	акциақәеи зыхә ҳараку ақьаадқәеи,
банковские вклады,	абанктә алаҵарақәа,
берегись гордости и самоуверенности!	аԥагьареи ахақәгәыӷреи шәҽырцәышәыхьчала!
билл уолден с готовностью шел на жертвы, и иегова его вознаградил	уолден билл ахамеигӡара аарԥшра дазхиан, убри аҟынтә иегова дизылԥхеит
благодаря богу и христу нас ждет свобода!	анцәеи христоси рыбзоурала ахақәиҭра ҳауеит!
благодаря чему зубы морских блюдечек оказались прочнее паучьего шелка?	избан асаан гәаҩа хәыҷ еиԥшу амшын иҭоу ашамҭа ахаԥыцқәа абызкаҭаҳа аасҭа изыӷәӷәоу?
благодаря чему такое будущее станет возможным?	изыбзоурахозеи уи аҩыза аԥсҭазаара?
« бог любит чистый народ »	« анцәа бзиа ибоит ицқьоу ажәлар »
« будем жить мирно »	« ҭынч ҳаицынхалап »
будет ли земля уничтожена?	иқәгахома адгьыл?
будь уверен: ты справишься с любым жизненным штормом, ведь после бури обязательно выглянет солнце	агәра ганы уҟаз: аԥсҭазааратә цәқәырԥақәа рыхгара улшоит, избанзар афырҭын ашьҭахь хымԥада амра цәырҵуеит
будьте сильными!	шәҽырӷәӷәаны шәыҟаз!
будьте смелыми!	агәымшәара аашәырԥшла!
в 2021 году вечеря воспоминания пройдет в субботу, поэтому встреча собрания в выходные дни проводиться не будет. по этой причине на следующую неделю статья для изучения не запланирована.	шықәсазы агәаларшәара ахәылԥаз асабшамш иақәшәоит аҟынтә, аԥсшьара мшқәа рзы аизара мҩаԥысӡом. убри аҟынтә анаҩстәи амчыбжь азы аҵаразы астатиа ҟалаӡом.
в библии нет прямых указаний в отношении кремации. в ней не уточняется, следует ли хоронить тело умершего или же кремировать.	абиблиаҿы акремациа иазкны иаартны акгьы анӡам. уа ишьақәырӷәӷәаӡам иԥсыз ауаҩы дыжтәу, мамзаргьы дбылтәу.
в день нашей свадьбы. 1951 год	шықәса. ҳанеибагаз амш аҽны
в 15- й главе первого письма коринфянам говорится о воскресении. почему это учение для нас так важно и почему мы можем быть уверены, что иисус воскрес? давайте обсудим эти и другие вопросы, связанные с воскресением.	актәи коринфаа рахь 15- тәи ахы аԥсҭалара иазкуп. избан ари аҵабырг ҳара ҳзы изхадоу, насгьы избан иисус иԥсы шҭалаз агәра ганы ҳаҟазар зҳалшо? ари астатиаҿы арҭ, насгьы аԥсҭалара иазку ихадоу егьырҭ азҵаарақәа рҭак ҳауеит.
в каких ситуациях сестрам может понадобиться наша защита?	ианбаҭаххар алшо ҳаҳәшьцәа рыхьчара?
в каких ситуациях тебе может потребоваться мужество, чтобы объяснить свои убеждения представителю власти?	иарбан ҭагылазаашьақәоу агәымшәара уҭаххар ахьалшо, амчра змоу ауаҩы угәрахаҵара иеилыркааразы?
в каких ситуациях тебе может пригодиться приложение jw language?	иуҭаххар анбалшо апрограмма jw language?
в каком случае евангелия по- настоящему нам помогут?	иҟаҵалатәузеи аевангелиеқәа ирну хәарҭа ҳзааргаларц азы?
в каком смысле мы можем находить удовольствие в оскорблениях?	избан ҳанҵәылырхуа гәахәара зҳауа?
« в каком состоянии находятся умершие? »	« иарбан ҭагылазаашьоу ирымоу иԥсхьоу? »
в каком теле они воскреснут?	иарбан цәеижьу ироуа?
в ночь перед своей смертью иисус вместе с верными апостолами пел песни хвалы иегове.	иисус иԥсра уахык шагыз изиашоу иапостолцәеи иареи иегова дзырҽхәо ашәақәа рҳәон.
в первый день на новой работе майкла кензела спросили: « как думаешь, виноват ли бог во всех страданиях и несчастьях? » это был поворотный момент в его жизни.	маикл кензел аусура ҿыц даналага аҽныҵәҟьа иазҵааит: « угәы ишԥаанаго, агәаҟрақәеи арыцҳарақәеи зегь анцәа ихароума? » уи иԥсҭазаара зегь аԥсахит.
