 адокументкәеи, аҭаӡқәеи аҳатә ҭыԥқәеи рҿа анеира азин	доступ к документам, папкам и сетевым местам
 аиҭагара адгылоит алокалт фаил сиситемаҿ мацара.	перетаскивание поддерживается только на локальных файловых системах.
 апанель ахала ааартра аанкылара 	задержка автораскрытия панели
 арӷьарахьтәи агәҭантәи апанель	правая центрированная панель
 арӷьарахьтәи иӡысо апанель 	правая плавающая панель
 ари ацаԥха шьақәыргылазар, асекундақәа убарҭахоит.	если этот ключ установлен, отображаются секунды.
 асервер аҽамадара ауам. асервер ахьӡ ҭагалатәуп.	невозможно подключится к серверу. необходимо ввести имя сервера.
 аус аруратә адыргаҷа ҿыц аԥҵатәуп	создать новый значок запуска
 аус ацашьа узырбо аиндикатор аҿы атекс	текст на индикаторе хода процесса
 аусуратә еишәақәа рыхьӡқәа:	наименования рабочих мест:
 аутентификациаҿы аиԥҟьара ҟалеит. анбанқәа ҭагалазар ауп ииашоу арегистр аҟны.	 сбой аутентификации. буквы должны быть введены в правильном регистре.
 афонтә ҭыхымҭа аԥкаарақәа	подробности фонового изображения
 ахәҭа ԥшаатәуп акәалаԥ : ахь иацҵазарц	найти элемент для добавления в ящик:
 ашьақәырӷәӷәара иадҵаалатәуп акаҵкәыр арыцқьареи афаилқәа раԥыхреи 	запрашивать подтверждение очистки корзины или удаление файлов
 иалышәх аиҿкаара, аинформациа адыргаҷақәа рыҵаҟа цәырҵлартә еиԥш. 	выберите порядок, в котором информация будет возникать под именами значков.
 илшома ахархәаҩ динамикала арццакыга аҭагалара ҿыц иактиву аекран мениу ақәкраан	может ли пользователь динамически вводить новый ускоритель при наведении на активный элемент меню
 ишыҟоу еиԥшишьақәыргылоуп	установить по умолчанию
ааигәа ахархәара змаз архив аарттәуп	открыть недавно использовавшийся архив
ааигәа ахархәара змаз афаил аарттәуп	открыть недавно использованный файл
ааиӷәа ихархәаз аарттәуп	отрыть недавно использовавшиеся
аамҭалатәи афаил аартраан аилахәара ҟалеит	произошёл сбой при открытии временного файла
аамҭалатәи афаил аҟынтә аԥхьараан аилахәара ҟалет	произошёл сбой при чтении из временного файла
аамҭеи арыцхәи шьақәыргылатәуп	установить дату и время
аарта амуит, даҽа аԥшьык алхтәума?	открыть не удалось, выбрать другое приложение?
аартра амуит, даҽа ҟаҵарак алхтәума?	открыть не удалось, выбрать другое действие?
аартра ахәҭақәа арбалатәуп	показывать элементы раскрытия
абжьаргыла ахықәкы ахьӡынҵа	список целей вставки
абжьаргыларҭа акәаԥ унарбома	показывается ли точка вставки
абжьытә фаиқәа рзыӡырҩра:	прослушивать звуковые файлы:
абзацаҿ иагоу ацәаҳәақәа рыбжьара ақәыԥшылара пиксельла	пикселей в пространстве между перенесёнными строками в абзаце
абзацтә хьаҵра, пиксельла	абзацный отступ, в пикселях
абираҟ- апытҟәыр ма арадио- пытҟәыр аиндикатор ашәагаа ма	размер индикатора кнопки- флажка или радио- кнопки
абитқәа рхыԥхьаӡара ҟьаԥсрак аҿы	число битов на плоскость
аблакнот иарбан гану агәылаҵақәа ахьыҟоу	на какой стороне блокнота помещаются вкладки
абларҭа аԥштәы афон ари атег ахь анырра ҟанаҵома	влияет ли этот тег на цвет фона ячейки
абларҭа афон аԥштәы асахьа аҭаны	цвет фона ячейки в виде строки
абларҭа афон шьақәыргылоуп	фон ячейки установлен
абларҭаҿы ахәҭақәа зланыԥшуа амодель	модель для отображения элементов в ячейке
абларҭқәа ирымоу анырра арбалатәуп	показывать чувствительность ячейки
абларҭқәа рыбжьара ииаалоу абжьажь. еиҩшоу хыԥхьаӡаразароуп	горизонтальный пробел между ячейками. должен быть четным числом
абраузер атерминал аҭахуп	браузеру нужен терминал
абраузер иеилнакаауеит инахароу адҵақәа	браузер понимает удалённые команды
абраузер ишыҟоу еиԥш иаҭахума атерминал	нуждается ли браузер по умолчанию в терминале
абраузер ишыҟоу еиԥш иеилнакаауама инахароу адҵа	понимает ли браузер по умолчанию удалённые команды
абри адҵа акьыԥьхьразы апринтер	принтер для печати этого задания
абыкь бжьы азы афаил ахьӡ	имя файла для звука гудка
аваратәи апанель арктәуп	закрыть боковую панель
аввиджет аҭагала ахы ианархәома	будет ли виждет использовать ввод
авиджет ақәыԥшы иактивуп	виджет образца активен
авиджет анҭыҵ ахәаақәа рҵакыра асахьазы	размер областей за пределами виджета для отрисовки
авиджет апыткәыр аҭбаара иақҿнагоу, асимволқәа рҿы.	желаемая ширина виджета кнопки, в символах.
авиджет аҭагалара афокус амоума	имеет ли виджет фокус ввода
авиджет аҭагарала афокус шьҭнахуама	будет ли виджет принимать фокус ввода
авиджет ахҵара ахәҭа ҳасабла ахархәараз	виджет для использования в качестве метки элемента
авиджет аҳәаақәа рҳәааҿ ацәаҳәақәа риагара ҟалома	будет ли происходить перевод строк у границ виджета
авиджет аҵакыра иахьынӡазалху аҟынӡа аиҵаргылақәа рыҽдырҭбаауеит	столбцы расширяются до размеров выделенной виджету области
авиджет убаратәы иҟалома	будет ли виджет видимым
авиджет, иаҳбац ахҵара арҭбаага ацымхәрас иаарԥшхо	виджет, который будет отображаться вместо обычной метки расширителя
автоматикала иҵәахлатәуп	автоматически скрывать
автоматла апанель акәакь ахь аҵәахра	автоматически прятать панель в угол
автоматла ирзеиԥшу иаԥсахуам	подставляется ли автоматически общий
автохыркәшара авариантқәа анубаалома иалшәо аԥенџьыр аҟны	отображаются ли варианты автозавершения в выпадающем окне
аганахьтәи апанель азы ахархәаратә фон ишыҟоу еиԥш ишьақәыргылоума.	установлен ли пользовательский фон по умолчанию для боковой панели.
аганахьтәи апанель арежим	режим боковой панели
аганахьтәи апанель аҭбаара	ширина боковой панели
аганахьтәи апанель уажәтәи аԥенџьыр аҟны иарбатәуп ма иԥхьактәуп	показать или скрыть боковую панель в текущем окне
агәаҽанызааратә рдырраҭара	предупреждающее сообщение
агәҵәылатәи аиҟаратәра иаҿыгоу ахәҭақәа рзы	вертикальное выравнивание для дочерних элементов
агәҵәылатәи амасштабыркра	вертикальное масштабирование
агәыларатә еиҵаргылақәа рыбжьара ибжьаӡо	расстояние между соседними столбцами
агәылатә цәаҳәақәа рыбжьара ибжьаӡо	расстояние между соседними строками
агәылаца ахҵара иаакәыршаны ахьацра аҭбаара	ширина отступа вокруг меток вкладки
агәылаҵа аргьарахь анахара	переместить вкладку вправо
агәылаҵа армарахь анахара	переместить вкладку влево
агәылаҵа аршшара ашәагаа	размер сглаживания вкладки
агәылаҵа аҭыԥ азыԥшаара	размещение вкладки
агәылаҵа иаҿаԥшуа аганаҿ ианыԥшроуп аҩбатәи апытҟәыр ахыц ԥхьаҟа ахы рханы	отображать вторую кнопку со стрелкой вперёд на противоположной стороне полосы вкладок
агәылаҵа иаҿаԥшуа аганаҿ ианыԥшроуп аҩбатәи апытҟәыр ахыц шьҭахьҟа ахы рханы	отображать вторую кнопку со стрелкой назад на противоположной стороне полосы вкладок
агәылаҵа ҵәҩанҵәытәи аҳәаа	вертикальная граница вкладки
агәылаҵақәа иеиҟароу ашәаагақәа рымоума	имеют ли вкладки одинаковый размер
агәылаҵақәа рыхҩара аҵакыра ашәагаа	размер области перекрытия вкладок
агәынкылара аихшара залшом апалитра рдыррақәа рзы	невозможно распределить память для данных палитры
агәынкылара аихшара залшом ацәаҳәа адыррақәа рзы	невозможно распределить память для данных строки
агәыԥ аԥсахра аҟәыхтәума?	отменить смену группы?
агәыԥ ахаҭарбага агәылаҵақәа реиҟәыҭхареи риагареи азы	идентификатор группы для отсоединения и переноса вкладок
агомогентә хәҭақәа зегьы иеиҟароу ашәагаа рымоума	имеют ли все гомогенные элементы одинаковый размер
агха иахырҟьана иаанкылоуп	остановлено из- за ошибки
агылара ашьақәыргылараз адҵаалара	запрос на установку высоты
агылаҵа азы ахҵара, ицхыраагӡоу ахәҭақәа змоу.	метка для вкладки, содержащей дополнительные элементы.
адаҟьа апараметркәа рхиатәуп	настроить параметры страницы
адаҟьа ашьашәалара ашәага	размер страницы подгонки
адаҟьа ашьашәалараз аиԥшьра	приращение для страницы подгонки
адаҟьа ишыҟоу еиԥш архиарақәа	настройки страницы по умолчанию
адаҟьа шеибгоу ихархәатәуп	использовать страницу целиком
адаԥа аҳәаа адәахьтәи аԥшра	внешний вид границы рамки
адәахьтәи абжьаӡара ишыкоу еиԥш	внешний интервал по умолчанию
адәахьтәи аминиатиуртәгақәа зегьы аҿыхтәуп	отключить все внешние миниатюризаторы
адәныҟатәи ахаргьежьра аҟны иалышәх ишәҭаху аԥштәы. иалышәх еиҳа илашьцоу маилашоу апштәхәы, аҩнуҵҟатәи ахкәакь ахархәарала.	выберите желаемый цвет на внешнем круге. выберите более тёмный или более светлый оттенки, используя внутренний треугольник.
адгылара змам аиҭагара атип ахархәара аман.	был использован недопустимый тип перетаскивания.
адиало цҳамҭа ихадоу атекст	главный текст диалога сообщения
адиалог алкаара аҵәцара 	прозрачность диалога выделения
адиалог иамоу аиҟәшага цәаҳәа апытҟәырқәа рханы	диалог имеет полосу разделителя над кнопками
адинамикала зыҽҭазгало амодульқәа	динамически загружаемые модули
адиректориа аҭаҩраан аилахәара ҟалеит 	сбой при записи индекса директории 
адиск ахь афаилқәа реиқәырхара аҿыхтәуп	отключить сохранение файлов на диск
адокумент зегьы алкаатәуп	выделить весь документ
адокумент уажәтәи адакьа	текущая страница документа
адокумент ҿыц аԥҵараан агха.	ошибка при создании нового документа.
адресқәа рыхьӡынҵа шәрыцқьар, хнырҳәышьа рымамкәа ианыҵуеит.	если вы очистите список адресов, они будут удалены безвозвратно.
адҵа анагӡаразы адыргаҷа	значок команды для выполнения
адҵа, ахыкәласрала имҩаԥырго:	команда, выполняемая при щелчке:
адырга ииаланы аиҟаратәра	горизонтальное выравнивание метки
адырга ҵәҩанҵәылатәи аиҟаратәра	вертикальное выравнивание метки
адыргақәа ацәаҳәақәа рҿы ианыԥсахыз арыцхә ала еилыԥшааны еиқәрхатәуп	сохранять значки отсортированными по дате изменения в строках
адыргақәа рыԥшра аҭаны аарԥшра	просмотр в виде значков
адырганҵа хархәатәуп иҩбатәу аҟны	использовать разметку во вторичном
адыргаҷ агылара ноль иаҟароуп	высота значка равна нулю
адыргаҷ аҭагалазы агәынкылара азхом	недостаточно памяти для загрузки значка
адыргаҷ аҭбаара ноль иаҟароуп	ширина значка равна нулю
адыргаҷа аҟны аҳәынаԥ ақәкраан ақәырԥшыга бжьы ианарҳәома	воспроизводить ли образец звука при наведении мыши на значок
адыргаҷа атагалара амуит	не удаётся загрузить значок
адыргаҷа аханатә изаҟараз аиҭашьақәыргылара	восстановить исходный размер значка
адыргаҷа ахәҭа аган аҿы анырԥшра	отображать значок рядом с элементом
адыргаҷа ашәагаа аҷыдаҟазшьа шьақәыргылоума	установлено ли свойство размера значка
адыргаҷа ашәагаа шьақәыргылоуп	размера значка установлен
адыргаҷа, аоабиект апытҟәырҵас ахархәара змоу	значок, используемый для кнопки объекта
адыргаҷакәа ирыхәаԥштәуп	просмотреть значки
адыргаҷақәа акаҭала еиҟаратәны еиқәырхатәуп	сохранить значки выровненными по сетке
адыргаҷақәа аханатә изаҟараз еиԥш ашьақәыргылара	восстановить исходные размеры значков
адыргаҷақәа ацәаҳәақәа рҿы аемблема ала еилыԥшааны еиқәырхатәуп	сохранять значки отсортированными по эмблемам в строках
адыргаҷақәа ацәаҳәақәа рҿы атип ала еилыԥшааны еиқәырхатәуп	сохранять значки отсортированными по типу в строках
адыргаҷақәа ацәаҳәақәа рҿы изаҟаро ала еилыԥшааны еиқәырхатәуп	сохранять значки отсортированными по размеру в строках
адыргаҷақәа ацәаҳәақәа рҿы рыхьӡқәа рыла еилыԥшааны еиқәырхатәуп	сохранять значки отсортированными по имени в строках
адыргаҷақәа раҳасабала арежим ахәаԥшразы амасштаб ишыҟоу еиԥш.	масштаб по умолчанию для режима просмотра в виде значков.
адыргаҷақәа рзы атема ахьаҵразы	тема значков для отката
адыргаҷақәа шьҭахьла раарԥшра	показывать значки в обратном порядке
адыргаҷақәа, иахеиҭагаз иааныжьлатәуп	оставлять значки там, куда они были перетащены
адыргаҷқәа рмасштаб ишыҟоу еиԥш	масштаб значков по умолчанию
адыргаҿ ихархәатәума иалху ашәагаа	использовать ли в метке выбранный размер
аекран аанкылара аҿыхтәуп	отключить блокирование экрана
аекран ахьчаҩ активизациа азутәуп	активировать хранитель экрана
аекран аҿы адиапазон аҽаԥсахлар шԥаку	как диапазон должен обновляться на экране
аекран зегь иҭаӡо иааныжьтәуп	оставить во весь экран
аекран, аԥенџьыр знубаалартә иҟало 	экран, на котором будет отображено окно
аеламент аԥышәхыр, уи рхынҳәышьа амамкәа иӡуеит.	если вы удалите элемент, он будет безвозвратно утрачен.
аелемент зныктәи ақәсра ала активтә азура	активировать элементы одним щелчком
аелемент ықәгахар, иара архыҳәышьа амамкәа иаҳцәыӡуеит.	если вы удалите элемент, он будет окончательно утрачен.
аелемент ҩынтәи ақәсрала активтәра азура	активировать элементы двойным щелчком
аелементқәа акаҵкәырахь аиҭагара амуит, рхыҳәышьа амамкәа иаԥыхтәума? 	не удалось переместить элементы в корзину, удалить их безвозвратно?
аелементқәа еишьҭаргылатәуп:	выстраивать элементы:
аелементқәа зегьы уажааигәа ахархәара змаз адокументқәа рҿы ирыцқьатәума?	очистить все элементы списка недавно использовавшихся документов?
аелеметқәа шьақәыргылатәуп	выстраивать элементы
аелемт аԥшаараа ҳасаб азнауама анбанқәа ррегистр ахьӡынҵа	учитывает ли поиск элемента в списке регистр букв
аелептизациа ашьақәыргылара	установка эллиптизации
аелиптра ацәаҳәа иахьанаало аҭыԥ, ацәаҳәа аарԥшра амеханизм абларҭқәҿы аҭыԥ азымхозар ацәаҳәа зегьы аарԥшразы.	желаемое место эллиптизации строки, если механизму отображения строки в ячейке не хватает места для отображения всей строки.
аемблема ҿыц азы аҭыхымҭа алхтәуп:	выбрать изображение для новой эмблемы:
аемблемазы ахьӡ ҿыц ҭажәгал:	введите новое имя для эмблемы:
аемблемақәа аарԥшлатәуп	показывать эмблемы
ажәабақәуа рхыԥхьаӡара, аҵаказы ианыԥшуа	число десятичных цифр, отображаемых для значения
ажәақәа риагара ҟалома авиджет аҳәаақәа рааигәара	будет ли делаться перенос слов на границах виджета
ажәпацәамкәа атекст азин аҭара	разрешать полужирный текст
ажәытә профильқәа рырхиара ииагоуп	настройка старых профилей перенесена
азгәаҭазы аҭакыра алхра	выбор поля для отметки
азеиԥш ус зегь ахәҭа, зынагӡараан апроцесс аиндикатор иадӷьалоит	доля общего объема работы, при выполнении которой происходит приращение индикатора процесса
азин ыҟоума арыдыркра аанкылара	разрешается ли блокирование клавиатуры
азинқәа иагәыло афаилқәа рахь игатәуп	распространить права на вложенные файлы
азкра аҭыԥ аҿы анҵаразы иақәнагоу азин шәымам.	у вас не достаточно прав на записи в место назначения.
азхьарԥш аԥҵаразы аҽазыҟаҵара иаҿуп.	идёт подготовка к созданию ссылок.
азыԥшра арежим ахь акомпиутер ииагатәуп	перевести компьютер в ждущий режим
азыԥшратә режим ахь ииастәуп	перевести в ждущий режим
аиааларала иашьашәало аҟаҵара	подгонка по горизонтали
аиагага- апытҟәыр асахьа ҭыхтәуп арадио- пытҟәыр еиԥш	рисовать кнопку- переключатель как радио- кнопку
