анимациа аҭагаларазы агәынкылара иҟоу азхом	недостаточно памяти для загрузки анимации
анкьатәи аусуратә еишәа ахь азхьарԥш	ссылка на старый рабочий стол
анырра змам апытҟәыр аҭагылазаашьа	нечувствительное состояние кнопки
анырра змам аҭагылазаашьа	нечувствительное состояние
аобект апозициа апанель аҟны	позиция объекта на панели
аобиект апанель аҿы иаҭатәуп	закрепить объект на панели
аобиект апытҟәыр азы даҽа дыргаҷак ахархәара аҭатәуп	использовать другой значок для кнопки объекта
аобиектқәа рпанель аидентификаторқәа рыхьӡынҵа	список идентификаторов объектов панели
аоперациа лыԥхала изалгоума	может ли операция успешно завершиться
апалитра ахархуара амоума	используется ли палитра
апанель аидентификаторқәа рыхьӡынҵа	список идентификаторов панели
апанель аобиект ҳгәыҳҽанӡамкәа аус хнаркәшеит 	объект панели неожиданно завершил работу
апанель апплетқәа ридентификаторқәа рыхьӡынҵа	список идентификаторов апплетов панели
апанель аԥыхра ашьақәырӷәӷәара	подтверждать удаление панели
апанель аус аруп. апанель ҿыц аус арухаӡом.	панель уже запущена. новая панель запущена не будет.
апанель ахәҭақәа реиҿкааразы аиҟәшага	разделитель для организации элементов панели
апанель ахырхарҭаз абжьгара	указание на ориентацию панели
апанель аҽҵәахра аанкылара	задержка автоскрытия панели
апанель ашәагаа пиксельла	размер панели в пикселях
апанель зынӡаск аанкылара	полная блокировка панели
апанель, апплет змоу, иаркуп	панель, содержащая апплет, заблокирована
апараграф афон аԥштәы ахьыӡ	имя цвета фона параграфа
апараграф афон аԥштәы цәаҳәаҵас	цвет фона параграфа как строка
апараграф афон шьақәыргылоуп	фон параграфа установлен
апиксельқәа акәыԥшылараҿы абзацқәа рханы	пикселей в пространстве над абзацами
апплет уажәтәи аконфигурациа аҟынтәи иаԥыхтәума?	удалить апплет из текущей конфигурации?
апринтер азы акьыԥхь аилазаара	система печати для принтера
апринтер аҭагылазаашьа ашьклаԥшра	следить за состоянием принтера
апринтер аҿы аҳасабтәқәа рхыԥхьаӡара	число запланированных в принтере задач
апрограмма автор изин иазку адырраҭара	информация о авторском праве программы
апрограмма авторцәа рыхьӡынҵа	список авторов программы
апрограмма адокументациа авторцәа рыхьӡынҵа	список авторов документации программы
апрограмма алхтәуп иалкаау адокумет аартразы	выбрать программу для открытия выбранного элемента
апрограмма нагӡатәуп адҵатә цәаҳәа алагаларала	выполнить программу путём ввода командной строки
апрограмма сахьала аиқәыршәара иалахәыз рыхьӡынҵа	список участвовавших в художественном оформлении программы
апрограммақәа реиԥш афаил анагӡара ақәиҭтәра	позволять выполнение файла как программы
апроцесс амҩаԥгара шымҩаԥысуа анубааларатә иҟалоума атекст асахьа аҭаны	будет ли ход выполнения процесса отображаться в виде текста
апунктқәа рыҟны ашрифт ашәагаа	размер шрифта в пунктах
апшь атерминал аҟны иҟоуп	приложение в терминале
апыткәыри иаҿыгоу обиекти рҳәаа ахырҷара.	окаймление между границами кнопки и дочерним объектом.
апытҟәыр аиагаратә аҭагылазаашьа	состояние переключения кнопки
апытҟәыр аиҭагага ахәҭа ананубаало иҟазар	если отображена переключающая часть кнопки
апытҟәыр иагәҭасны ианыҟоу аԥхьатәи аанкылара аамҭа	время первоначальной задержки при нажатии кнопки
апытҟәыр иагәҭасны ианыҟоу, аиҭаҟаҵара аанкылара аамҭа	время задержки повтора, когда кнопка нажата
апытҟәыр иақәыӷәгӷәаны ианыҟоу аиҭага аҵакы арццакра	ускорение прокрутки значений при удерживании нажатой кнопки
апытҟәыраҿ авиджет- адырга атекст, апытҟур адырга амазар.	текст виджета- метки на кнопке, если кнопка содержит метку.
апытҟәырқәа алашара аҵарԥхалатәуп аҳәынаԥ анақәку	подсвечивать кнопки при наведении мыши
апытҟәырқәа еиҵаӡоу рргылара аконтеинер аҩныҵҟа 	минимальная высота кнопок внутри контейнера
апытҟәырқәа еиҵаӡоу рыҭбаара аконтеинер аҩныҵҟа 	минимальная ширина кнопок внутри контейнера
апытҟәырла аиҵаргыла ахы аԥсахразы анапхгара ахәҭа	элемент управления для замены заголовка столбца кнопкой
аԥенџьер ҿыц аҿы иаарттәуп	открыть в новом окне
аԥенџьыр аарԥштәуп, аусуратҿ еишәаҿы шәџьоуҳар мамзаргьы афон аԥштәы ашьақәыргылара шәақәиҭызтәуа 	показать окно, которое позволит вам установить ваш орнамент или цвет фона рабочего стола
аԥенџьыр агылара ишыҟоу еиԥш, ухы иауырхәоит раԥхьаӡа аԥенџьыр ианаарԥшхо	высота окна по умолчанию, используется при первоначальном отображении окна
аԥенџьыр адаԥа аркыга апытҟәыр амоума	имеет ли рамка окна кнопку закрытия
аԥенџьыр алагамҭатә апозициа	начальная позиция окна
аԥенџьыр аҭбаара ишыҟоу еиԥш, раԥхьаӡа аԥенџьыр аарԥшраан ахархәара аиуеит	ширина окна по умолчанию, используется при первоначальном отображении окна
аԥенџьыр ҿыцқәа рҿы аганахьтәи апанель арбалатәуп	показывать боковую панель в новых окнах
аԥенџьыр ҿыцқәа рҿы адрес аҭагалара цәаҳәа арбатәуп	показывать строку ввода адреса в новых окнах
аԥенџьыр ҿыцқәа рыҟны аганахьтәи апанель азы аҭбаара ишыҟоу еиԥш.	ширина по умолчанию для боковой панели в новых окнах.
аԥенџьыр ҿыцқәа рыҟны адыргаҷақәа ижәпаны ранҵара ахархәара рзутәуп	использовать плотное размещение значков в новых окнах
аԥенџьыр ҿыцқәа рыҟны амыругақәа рпанель арбалатәуп	показывать панель инструментов в новых окнах
аԥенџьыр ҿыцқәа рыҟны ацәаҳәа аҭагылазаашьа арбалатәуп	показывать строку состояния в новых окнах
аԥенџьырқәа ахаангьы еидыргәыԥлатәым	никогда не группировать окна
аԥенџьырқәа зегь реикәаԥсареи аусурҭатә еишәа арыцқьарази абраҟа шәақәыӷәӷәа	щёлкните здесь для сворачивания всех окон и расчистки рабочего стола
аԥенџьырқәа реиҭашьақәыргылараан еиҭагалатәуп уажәтәи аусуратә еишәахьы 	перемещать окна на текущее рабочее место при восстановлении
аԥенџьырқәа рменеджер аҿы апенџьыр адаԥа асахь анубаалома	отрисовывается ли рамка окна менеджером окон
аԥенџьырқәа рыбжьара анавигациаз апплетқәа рфабрика	фабрика апплетов навигации между окнами
аԥенџьырқәа рыхьӡынҵа иминималу ашәагаа	минимальный размер списка окон
аԥенџьырқәа рыхьӡынҵақәа зегьы мениуҵас иунарбоит иагьулнаршоит дара- дара рыбжьара аиҭаҵра.	отображает список всех окон в виде меню и позволяет переключаться между ними.
аԥкаара аҩаӡара ишыҟоу еиԥш иарбалатәуп	показывать с уровнем детализации по умолчанию
аԥсшьара ахырԥара азин аҭатәуп	разрешить откладывание перерыва
аԥхьа иҟаз аиқәшәарақәа ҳаԥшаап	найти предыдущее совпадение
аԥхьаӡага ашкала аегьи аҵыхәахь иасуама аҵакыра аҳәаа анхартәаахалагь	будет ли счетчик переходить к другому концу шкалы при достижении предельных значений
аԥхьаӡага- апытҟәыр аҵакы зыхьчо, аҷыдақазшьа	свойство, хранящее значение кнопки- счётчика
аԥхьаӡага- апытҟәыр иаакәыршаны арнаара астиль	стиль скоса вокруг кнопки- счётчика
аԥхьатәи аплан шьақыргылоуп	передний план установлен
аԥшаага акритериақәа аԥыхтәуп	удалить критерий поиска
аԥшаара аиқәырхаразы акаталог алхтәуп	выбрать каталог для сохранения поиска
аԥшаара акритери ҿыц ацҵатәуп	добавить новый критерий поиска
аԥшаара еиԥш. еиқәырхатәуп	сохранить поиск как.
аԥшаара нагӡатәуп ма ирҿыцтәуп	выполнить или обновить поиск
аԥшааразы акаталог алхтәуп	выбрать каталог для поиска
аԥшааратә критери аԥшаага панель азы	критерий поиска для поисковой панели
аԥшәма иԥсахра аҟәыхтәума?	отменить смену владельца?
аԥштәқәа рыхсаала аилазаара ахәҭа азы агәынкылара ашара замуит	не удалось распределить память для элементов карты цветов
аԥштәы алхраз аидиалог ахы	заголовок диалога выбора цвета
аԥштәы ашьақәыргылара ауам.	цвет не может быть установлен.
аԥштәы еиқәырхатәуп абра	сохранить цвет здесь
аԥшь алхтәуп иара ахәәаа ахәаԥшразы.	выбрать приложение для просмотра его описания.
аԥшьқәа иҷыдоу алшарақәа ахархәара азырурома	следует ли приложениям использовать специальные возможности
аԥшьқәа рԥенџьыркәа зегь еикәаԥсаны аусурҭа еишәа арбатәуп 	свернуть все окна приложений и показать рабочий стол
аԥшьы аҟны даҽа шрифтк ахархәара азутәума	использовать ли другой шрифт в приложениях
аԥшьы аус арураан агха ҟалеит.	произошла ошибка при запуске приложения.
аԥшьы иацхраауа авиджет афаил ақәыԥшыӷақәа рарбаразы.	поддерживаемый приложением виджет для отображения образцов файлов.
аԥшьы иацхраауа авиджет ихарҭәаау аопциақәа рзы.	поддерживаемый приложением виджет для дополнительных опций.
аԥшьы ишиашоу авиджет аҟны асахьа аннаҵома	будет ли приложение рисовать напрямую в виджете
арадио- елемент еиԥш асахьаҭыхра	рисовать как радио- элемент
арадио- пытҟәыр ма апытҟәыр- бираҟ аиндикатор акәша- мыкуша ақәыԥшылара	пространство вокруг индикатора кнопки- флажка или радио- кнопки
арадио- пытҟәыр, агәыԥахь ари апытҟәыр зҵазкуа	радио- кнопка, к группе которой принадлежит данная кнопка
араҟа адҵатә цәаҳәа ҭагалатәуп. 	ввести здесь командную строку.
арастр акәаԥқәа рхыԥхьаӡара, ахырхага ииагахаанӡа иҟазаарц ахьалшо	число точек растра, на которое может сместиться курсор до перетаскивания
арастрт ацәахәа аиҭагагеи аԥенџьыр еиҭагагеи ирыбжьаӡо акәаԥқәа рхыԥьхьаӡара	количество точек растра между полосами прокрутки и прокручиваемым окном
арбага аҭагылазаашьа ашьақәыргылара	определять положение указателя
арбага ахәҭақәа гәыԥла аиҭныԥсахлара ауеит	элементы просмотра можно перегруппировывать
арбага ашьҭахь иашьҭоума алкаара	следует ли выделение за указателем
арӷьарахь ацәаҳәа аҭагылазаашьа аарԥшра ақәнагоума	следует ли отображать строку состояния справа
арӷьарахьтәи ирҭбаау агантәи апанель	правая расширенная краевая панель
арӷьеи армеи апытҟәырқәа рҭыԥқәа ԥсахтәуп арма напы аҵаҟа иҟоу аҳәынаԥ азы	менять местами правую и левую кнопки для мышей под левую руку
ардырра апанель ахырхарҭа	ориентация панели уведомлений
арегисирахь еиҳа иацәанырраны	чувствительный к регистру
аредакциалшара шьақәыргылоуп	редактируемость установлена
арелиефтә ҳәаақәаа астиль	стиль рельефа границы
ари адрес аарԥшраан алаԥшхаратә компонент ахьӡынҵеиԥш иаарԥштәуп.	использовать просмотр в виде списка при отображении этого адресе.
ари адрес аарԥшраан идырым аҩныҵҟатәи агха ҟалеит.	произошла неизвестная внутренняя ошибка при отображении этого адреса.
ари адрес аарԥшразы аусурҭа аишәа алаԥшхгара архәара аҭатәуп.	использовать просмотр в виде рабочего стола для отображения этого адреса.
ари адрес иадҳәаланы, аҟаҵазаара ишыҟоу еиԥш аус арураан агха ҟалеит.	произошла ошибка при запуске действия по умолчанию, связанной с этим адресом.
ари адрес иадҳәалоу, ишыҟаз еиԥш аҟаҵазаара ыҟам.	отсутствует действие по умолчанию, связанная с этим адресом.
ари аелемент ахьӡ ԥсахра ҟалом.	этот элемент не может быть переименован.
ари азхьарԥш хархәашьа амам, избанзар ахықәкы амам.	эта ссылка не может быть использована, поскольку она не имеет цели.
ари акаҵкәыр аиагара ҟалом.	вы не можете переместить эту корзину.
ари акомпиутер аҿыхтәума?	выключить этот компьютер?
ари анапхгара ахәҭа агылара ашьақәыргылараз адҵаалара аԥсахра ма - 1,ихалагаратәиу ашьҭаҵаа ахархәара ақәшәар	изменение запроса на установку высоты этого элемента управления или - 1, если нужно использовать исходный запрос
ари анимациа ахкы аднакылом	данный тип анимации не поддерживается
ари апытҟәыр иалнаршоит аԥенџьырқәа зегьы рыҵәахреи аусуратә еишәа арыцқьареи	эта кнопка позволяет скрыть все окна и расчистить рабочий стол
ари аԥенџьыр аганахьтәи апонель аԥшра ԥсахтәуп	изменить видимость боковой панели этого окна
ари аԥенџьыр адрес ацәаҳәа аԥшра ԥсахтәуп	изменить видимость строки адреса этого окна
ари аԥенџьыр азы адыргаҷа	значок для этого окна
ари аԥенџьыр атема аҟнытә адыргаҷа ахьыӡ	имя значка из темы для этого окна
ари аԥенџьыр аҭагылазаашьа ацәаҳәа аԥшра ԥсахтәуп	изменить видимость строки состояния этого окна
ари аԥенџьыр аҿы аелементқәа зегьы иаокаатәуп, иарбоу ашаблон иақәшәо	выделить в этом окне все элементы, соответствующие приведенному шаблону
ари аԥенџьыр ихадоу амыругақәа рпанель аԥшра ԥсахтәуп	изменить видимость основной панели инструментов этого окна
ари аԥхьа шәызҭааз адрес ахь ииастәуп	перейти к предыдущему посещенному адресу
ари аԥшьазы узыԥхьартә иҟоу ахьӡ	читаемое название для этого приложения
ари аԥшьы аҿы ахархәара змоу, аидентификатор ацәаҳәа	строка идентификатора, используемая этим приложением
ари асеанс азы абызшәа алшәх:	выберите язык для этого сеанса:
ари асеанс иалгатәуп, даҽа хархәаҩк ихьӡала анеиразы	завершить этот сеанс, чтобы войти под именем другого пользователя
ари асервер аҽамадатәуп	соединиться с этим сервером
ари асерверахь еснагьтәи аимадара аԥҵтәуп	создать постоянное соединение с этим сервером
ари асистематә сеанс ишыҟоу еиԥш	это системный сеанс по умолчанию
ари атег аашрифт ашәагаа масштабркраа ауама коефицентла	масштабирует ли этот тег размер шрифта на коэффициент
ари атег абзацқәа реиҟаратәраан анырра ҟанаҵома	влияет ли этот тег на выравнивание абзацев
ари атег аеллиптизациа арежим ианыруама	влияет ли этот тег на режим эллиптизации
ари атег анахара ианыруама	влияет ли этот тег на смещение
ари атег анырра ҟанаҵома ииагоу ацәаҳәақәа ирыбжьаӡо апиксельқәа рхыԥхьаӡара	влияет ли этот тег на количество пикселей между перенесенными строками
ари атег апараграф афон аԥштәы ианыруама	влияет ли этот тег на цвет фона параграфа
ари атег аԥхьатәи аплан аԥштәы азнауама	влияет ли этот тег на цвет переднего плана
ари атег аԥхьатәи аплан асахьа ианыруама	влияет ли этот тег на узор переднего плана
ари атег арӷьатәи аҭакыра ианыруама	влияет ли этот тег на правое поле
ари атег атабулиациа ианыруама	влияет ли этот тег на табуляцию
ари атег атекст арбара ианыруама	влияет ли этот тег на видимость текста
ари атег атекст аредакциаҟаҵара анырра азнауама	влияет ли этот тег на редактируемость текста
ари атег аҭыхратә бызшәа атекст ианыруама	влияет ли этот тег на язык отрисовки текста
ари атег афон агылара ианыруама	влияет ли этот тег на высоту фона
ари атег афон аџьоуҳарра анырра анаҭома	влияет ли этот тег на узор фона
ари атег ахьаҵ анырра анаҭома	влияет ли этот тег на отступ
ари атег ацәаҳәақәа риагара арежим ианыруама	влияет ли этот тег на режим переноса строк
ари атег ацәаҳәақәа рхыхь апиксельқәа рхыԥхьаӡара анырра анаҭома	влияет ли этот тег на количество пикселей над строками
ари атег аҵәаӷәара ианыруама	влияет ли этот тег на перечёркивание
ари атег ашрифт авариант ианыруама	влияет ли этот тэг на вариант шрифта
ари атег ашрифт араӷара ианыруома	влияет ли этот тэг на разрядку шрифта
