ацәаҳәа хыхь арастр акуаԥқәа	точек растра над строками
ацәаҳәабжьатәи абжьаӡара	межстрочный интервал
ацәаҳәақәа ахаангьы ииагатәӡам, ажәа аҳәаа ала ма асимвол ала ииагатәхома	никогда не переносить строки, переносить ли по границам слов или по символам
ацәаҳәақәа аҵлаҿы ианубаалоума	будут ли отображаться линии в дереве
ацәаҳәақәа иеиԥшым ԥштәыла ашәра азин рыҭатәуп	разрешить окраску строк в разный цвет
ацәаҳәақәа риагара арежим	режим переноса строк
ацәаҳәақәа рынцәамҭа ахәҭақәа	детали окончания строк
ацәаҳәалдага хыхьтәи аҳәаа	верхний предел линейки
ацәаҳәалдага ҵаҟатәи аҳәаа	нижний предел линейки
ацәаҳәалдагаҿ адырга аҭыԥ	расположение отметки на линейке
ацкарқәа реиҟаратәра шьақәыргылоуп	выравнивание краёв установлено
ацхыраара зҭаххо апрограммақәа аус аруразы, ахархәара ззухо атерминал	терминал, который используется для запуска нуждающихся в нём программ
ацҳамҭа адиалогатә тексти апытҟәырқәеи рыбжьара ибжьаргылатәума аиҟәыҭхага	помещать ли разделитель между текстом и кнопками диалога сообщений
ацҵаразы аԥштәы алхтәуп	выбрать цвет для добавления
аҵакыра, ардырра адыргаҷақәа ахьцәырҵуа	область, в которой появляются значки уведомления
аҵакырақәа инверттәуп, иҳәазақәо рыла иалкаау, адиапазон арҭбааразы	инвертировать области, отмеченной ползунками, для увеличения диапазона
аҵаҳәара агхара ажәамаӡаҿы	задержка подсказки в пароле
аҵаҳәараҿы арыцхә арбалатәуп	показывать дату в подсказке
аҵаҵеиԥш ахархәара аҭатәуп 	располагать в виде обоев
аҵәахратә пытҟәыркәа аарԥшлатәуп	показывать кнопки скрытия
аҵәцара анапхгара амоуп	имеет управление прозрачностью
аҵәцара ахархәара аҭатәуп	использовать прозрачность
аҵәцара, афонтә сахьа ахьынтәақәҭыхтәу	прозрачность, с которой отрисовывать фоновую картинку
аҵла аартра ахәҭақәа арбалатәуп	показывать элементы раскрытия дерева
аҵла акаҭа ацәаҳәақәа арбалатәуп	показывать линии в сетке дерева
аҵла асахьа аҭаны излахәаԥшуа амодель	модель для просмотра в виде дерева
аҵыхәтәан инагӡаз адҵа ала алкаа гәаҭатәуп	просмотреть вывод от последней выполненной команды
аҵыхәтәантәи аиҭакрақәа ҳархынҳәып	вернуть последнее изменение
аҵыхәтәантәи аҟаҵара аԥыхтәуп	отменить последнее действие
аҽҭаҩра аҽазышәара лыҵшәадахеит.	попытка регистрации не удалась.
ашаблонқәа шьақәыргылам	шаблоны не установлены
ашәагаа аҽызлаԥсахуа акәакь амоуп	имеет уголок изменения размера
ашәарҭадара иахырҟьаны ари ҿыхәуп.	это отключено по соображениям безопасности.
ашәыгақәа ршәагаа 8- бит змоу арежим аҟны	размер палитры в 8- битном режиме
ашәыгатә қәыԥшылара, аҟьаԥсрақәа аинтерпретациа ахьаиуа	цветовое пространство, в котором плоскости интерпретируются
ашрифт авариант шьақәыргылоуп	варианта шрифта установлен
ашрифт алгара шьақәыргылоуп	насыщенность шрифта установлена
ашрифт амасштаб шьақәыргылоуп	масштаба шрифта установлен
ашрифт амасштабркра акоефицент	коэффициент масштабирования шрифта
ашрифт араӷара шьақәыргылоуп	разрядка шрифта установлено
ашрифт астиль шьақәыргылоуп	стиль шрифта установлен
ашрифт ахҳәаа, аусуратә еишәаҿы адыргаҷақәа аҵаҩымҭа әасабла ахархәара зауа.	описание шрифта, использующегося для подписей к значкам на рабочем столе.
ашрифт ахышәара аекранаҿ ишыҟоу еиԥш	параметры шрифта на экране по умолчанию
ашрифт ахьӡ ишыҟоу еиԥш, адокументқәа раԥхьаразы ахархәара ззухо	имя шрифта по умолчанию, используемого для чтения документов
ашрифт ашәагаа шьақәыргылоуп	размера шрифта установлен
ашрифтқәа рҭаацәара шьақәыргылоуп	семейство шрифта установлено
аштрихқәа рҿырԥшы- индикатор арбаразы аҭагалара афокус	образец штрихов для отображения линии- индикатора фокуса ввода
ашьаҿа иашьашәалан аҟаҵараз аиԥшьра	приращение для шага подгонки
аҩада аҩахара анырралшара	чувствительность сдвига вверх
аҩбатәи апытҟәыр ахыц аԥхьҟа ирханы иаҿаԥшуа аган ацәаҳәа аиҭагагаианубаало	отображать вторую кнопку со стрелкой вперёд на противоположной стороне полосы прокрутки
аҩбатәи апытҟәыр ахыц ашьҭахьҟа ирханы иаҿаԥшуа аган ацәаҳәа аиҭагагаианубаало	отображать вторую кнопку со стрелкой назад на противоположной стороне полосы прокрутки
аҩбатәи ахырхага аԥштәы	цвет второго курсора
аҩнтәи аҭаӡ ахь ииастәуп	перейти в домашнюю папку
аҩнытә каталог ахь аиасра	перейти к домашнему каталогу
аҩнытәи акаталог адыргаҷа аусуратә еишәаҿы иҟоуп	значок домашнего каталога присутствует на рабочем столе
даҽа ҟаҵарақәак ари афаил алаԥшхгаразы ыҟам. амала ари афаил шәкомпиутер ахь акопи азыҟашәҵар, аартра шәылшоит.	другие действия для просмотра этого файла недоступны. если вы скопируете этот файл на свой компьютер, вы сможете открыть его.
даҽа программак аҿы иаарттәуп.	открыть в другой программе.
даҽа хәаԥшыгатә программак алышәх нас даҽазнык шәҽазышәшәа.	выберите другую программу просмотра и попробуйте еще раз.
даҽа шрифтк ахархәара азутәуп	использовать другой шрифт
егьырҭ аҭаӡқәа иргәылаԥштәуп	просмотреть другие папки
еикәаԥсаоу аԥенџьырқәа реиҭашьақәыргыларазы абраҟа шәақәыӷәӷәа 	щёлкните здесь для восстановления свёрнутых окон
еиқәырхоу аԥшаара аредакциа азутәуп	редактировать сохраненный поиск
еиҟаратәны еиқәырхатәуп	сохранять выровненными
еилкаам афона ахкы ҳауит	получен неизвестный тип фона
еиԥҟьоу аԥшь аусура мчыла ахыркәшара	принудительно завершает работу сбоящего приложения
еиҭаку аԥшаара еиқәырхатәуп	сохранить измененный поиск
еиҭаҵуа аԥенџьыр аҭагылазаашьа	положение прокручиваемого окна
еиҩшам ацәаҳақәа рзы аԥштәы	цвет для нечётных рядов
еиҩшам ацәаҳақәа рыԥштәы	цвет нечётных рядов
еиҩшоу ацәаҳәақәа рзы аԥштәы	цвет для чётных рядов
елементқәак акаҵкәырахь аиҭагара амуит, архыҳәышьа амамкәа иаԥыхтәума? 	некоторые элементы не удалось переместить в корзину, удалить их безвозвратно?
еснагь ахархәара азутәуп адрес аҭагалара апанель мҩа аҭыԥан	всегда использовать ввод адреса вместо панели пути
зныктәи ақәықшарала адыргаҷақәа аартлатәуп	открывать значки одиночным щелчком
зхы иақәиҭу агәынкылара азхом	недостаточно свободной памяти
зыҽзырҭбаауа аиҵаҩ иазалхтәуп аиҵаҩ	задать колонку для расширяемой колонки
зыҽзырҭбаауа аобиектқәа рҿы ахьаҵқәа ҟанаҵоит	создает отступы в расширяемых объектах
иаабатәу аформаҿ афаил азы азин.	права на файл в восьмеричной форме.
иаанхаз ахәҭа аиқәырхара амуит	не удалось сохранить оставшуюся часть
иаарԥшхо адокументқәа рыхкқәа алышәх	выберите типы отображаемых документов
иаарԥшхо аиҵаргылақәа рхыԥхьаӡара	количество отображаемых столбцов
иаарту аԥенџьырқәа акакала рартра апытҟәырқәа рыла	переключение между открытыми окнами при помощи кнопок
иаарту арҭбаага аԥшаара залшома иаҿыгоу ахәҭақәа	может ли открытый расширитель обнаруживать дочерний элемент
иаарту аҭаӡ акаҵкәырахь аиҭагара	переместить открытую папку в корзину
иаарту аҭаӡ алаԥшхгара ма аҟазшьа ааиҭакра 	просмотреть или изменить свойства открытой папки
иаарту аҭаӡ рхынхәышьа амамкәа аԥыхра	окончательно удалить открытую папку
иаарту афаилқәа зегьы арктәуп	закрыть все открытые файлы
иаарту афаилқәа зегьы еиқәырхатәуп	сохранить все открытые файлы
иабантәи ааи ари аԥсыӡ гаӡа	откуда приплыла эта глупая рыбка
иагәҭасны иҟоума аиҭагага- апытҟәыр	нажата ли кнопка- переключатель
иагәылоу аҭаӡқәа аҿактәуп	включать вложенные папки
иагоу ацәаҳәақәа рыбжьара апиксель	пиксели между перенесенными строками
иаднакылома иҭагалоу асимвол атабулиациа	будет ли приниматься введённый символ табуляции
иажәыз афаилқәа бжьажьлатәуп	пропускать устаревшие файлы
иажәыз аҷыдаҟазшьа, гәыгәҭажьхоит	устарелое свойство, игнорируется
иазгәаҭоу агылара арежим	режим фиксированной высота
иазԥхьагәаҭам аԥштәы аҵаулара ԥшаан аԥштәқәа рыхсаала ахәҭа азы	непредвиденная глубина цвета обнаружена для элемента карты цветов
иактивума аиҭагага- апытҟәыр	активна ли кнопка- переключатель
иактивызтәуа аҵакыра азгәаҭоуп асахьа аҳәаа анҭыҵ	активирующая область определена за границами изображения
иақәнагоу аԥшь аԥшаара залмыршахеит	не удаётся найти подходящее приложение
иақәнагоума аконтексттә мениу атекст аҭагалара аелементқәа аметод аԥсахра адгалара аҭагалара	должны ли контекстные меню элементов ввода текста предлагать сменить метод ввода
иақәнагоума аконтексттә мениу атекст аҭагалара аелементқәа иадыргаларц аҭаргылара анапхгаратә символқәа	должны ли контекстные меню элементов ввода текста предлагать вставить управляющие символы
иақәнагоума алагылазаара аусурҭа еишәа ҭнахлартә	должна ли среда отрисовывать рабочий стол
иалкаатәуп аус аруразы атерминал аԥенџьыр аҿы.	отметить для запуска команды в окне терминала.
иалкаау агәылаҵа аԥыхтәуп	удалить выделенную закладку
иалкаау адыргаҷақәа еиҵыҵуа иҟаҵатәуп	делать выделенные значки растягивающимися
иалкаау аелемент ахьӡ аԥсахра	переименовать выделенный элемент
иалкаау аелементқәа зегьы рхынҳәышьа рымамкәа иаԥыхтәуп	окончательно удалить все выделенные элементы
иалкаау атекст агәылаԥҟатәуп	вырезать выделенный текст
иалкаау атекст акопиа ақәҭыхтәуп	копировать выделенный текст
иалкаау атекст аԥсахра абуфер ахь иақәҭыхтәуп	копировать выделенный текст в буфер обмена
иалкаау атекст аԥсахра абуфер ахь игәылаԥҟатәуп	вырезать выделенный текст в буфер обмена
иалкаау атом агәылхтәуп 	извлечь выделенный том
иалкаау аҭаӡ азы иаԥҵатуп агәылаҵа	создать закладку для выделенной папки
иалкаау аҭаӡқәа рзы агәылаҵақәа аԥҵатәуп	создать закладки для выделенных папок
иалкаау афаил алаԥшхгара	просмотреть выделенный файл
иалкаау афаил ахь анеира азин еилкаашьа амам.	права доступа для выделенного файла не могут быть определены.
иалкаау афаилқәа рыхьыӡ ԥсахтәуп	переименовать выделенные файлы
иалкаау ахәҭақәа архив аҟнытә ианыхтәуп	удалить выделенные элементы из архива
иалкаау ахәҭақәа ркопиа ахыхтәуп	копировать выделенные элементы
иалкаау ахәҭақәа ҭырффатәуп	вырезать выделенные элементы
иалкаау елемент цыԥҳьаӡа акаҵкәырахь еиҭагатәуп	переместить каждый выделенный элемент в корзину
иалкаау елементцыԥхьаӡа аԥенџьер ҿыц аҿы иаартлатәуп	открыть каждый выделенный элемент в новом окне
иалкаау елементцыԥхьаӡазы асимволикатә зхьарԥш аԥҵатәуп	создать символическую ссылку для каждого выделенного элемента
иалкаауцыԥхьаӡа аелемет алаԥшхгара ма аҟазшьа ааиҭакра 	просмотреть или изменить свойства каждого выделенного элемента
иалнаршома аԥштәы алхра адиалог аҵәцара анапхгара	позволяет ли диалог выбора цвета управление прозрачностью
иалху аелемент ари аԥенџьераҿ аартра	открыть выбранный элемент в этом окне
иалху аелемет аартразы даҽа аԥшьык алхтәуп	выбрать другое приложение для открытия выбранного элемента
иалшәо аелементқәа аиҟәҟьара цәаҳәа рымоума	имеют ли выпадающие элементы линию разрыва
иалшәо аиндикатор ашәага	размер выпадающего индикатора
иалшәо амениу адаԥа амоума иаҿыгоу аелемент иахыкәшо	имеет ли выпадающее меню рамку вокруг дочернего элемента
иалшәо амениу афокус иааннакылома аҳәынаԥ ахыкәласраан	перехватывает ли выпадающее меню фокус при щелчке мышью
иалшәо ахәҭа ахархәара залмыршахеит	не удаётся использовать выпадающий элемент
иалшәх аемблемаз даҽа хьӡык.	выберите другое имя эмблемы.
иалышәх аиҿкаара, аинформациа адыргаҷақәа рыҵаҟа цәырҵлартә еиԥш. амасштаб аиёәатәраан еиҳа аинформациа цәырҵлоит.	выберите порядок, в котором информация будет возникать под именами значков. при увеличении масштаба будет появляться больше информации.
ианонимтәу атег ԥшаауп, атегқәа раԥҵара залшом.	найден анонимный тег, не могут быть созданы теги.
ианубаало адыргаҷақәа реизга	отображаемый набор значков
ианубаало афаилқәа ралхразы уажәтәи араӡага	текущий фильтр для выбора отображаемых файлов
ианубаало ахәҭақәа реилыԥшаашьа	порядок сортировки отображаемых элементов
ианубаало ижәабатәиу аразриадқәа рхыԥхьаӡара	количество отображаемых десятичных разрядов
ианыхыз еиҭашьақәыргылатәуп 	восстановить удалённое
ианышьақәыргылоу, аиҭаҵрақәа рыхҭысқәа ардырра ари аекран ахәҭақәа рахь инеиӡом	когда установлено, события уведомления о перемещении не доставляются для элементов этого экрана
иаԥыхыз аҟаҵара ыргьежьтәуп	вернуть отменённое действие
иарбатәум имаӡақәоу рыхәҭакәа	показывать ли конфиденциальные элементы
иарбатәума ахәҭақәа, уахьзымнаӡо аресурсқәа узырбо	показывать ли элементы, указывающие на недоступные ресурсы
иарбоу афаил даҽа хьӡык ала еиқәырхатәуп	сохранить текущий файл под другим именем
иарбоу ацәаҳәахьы ииастәуп	перейти к указанной строке
иахьымнеиц азхьарԥш аԥштәы	цвет непосещённой ссылки
иацҵатәуп ма ианыхтәуп.	добавить или удалить.
иаҿактәуп ицхыраагӡоу алшарақәа ацәаҳәақәа рынҵәамҭақәа асахьа ҭызхуа	включить дополнительные возможности темы по отрисовке окончаний строк
иаҿакума иаразнактәи аныхра	включено ли немедленное удаление
иаҿгоу авиджет ииааланы апозициа	позиция дочернего виджета по горизонтали
иаҿгоу ахәҭа аиндекс ахылҵ- хәҭаҿы	индекс дочернего элемента в элементе- родителе
иаҿыгоу авиджет гәҵәыла апозициа	позиция дочернего виджета по вертикали
иаҿыгоу авиджет, аекранаҽ апытҟәыр аиекст аганаҿ ицәырҵуа	дочерний виджет, появляющийся на экране рядом с текстом кнопки
иаҿыгоу авиджет, аекранаҿ ицҿырҵуа амениу аманиу атекст аганаҿ	дочерний виджет, появляющийся на экране рядом с текстом меню
иаҿыгоу амениу аилаҳәара ахырхарҭа	направление упаковки дочернего меню
иаҿыгоу амениу амениҩ иацҵатәума	следует ли добавлять отделённые меню к меню
иаҿыгоу ахәҭа иахьыԥшуп	подчиняться дочернему элементу
иаҿыгоу ахәҭа шаҟа еиҭагатәузеи гәҵәыла, апытҟәыр иагәҭасны иҟазар	на сколько переместить дочерний элемент по вертикали, если нажата кнопка
иаҿыгоу ахәҭақәа агәылаҵақәа ханарҭәаауама аҵакыра зегьы	заполняют ли вкладки дочернего элемента всю область
игәҵәыланы ианыҟоу иубарҭоуп	видим при вертикальном расположении
идыру аԥшьқәа рыхьӡынҵа 	список известных приложений
иеизаку ахьӡынҵа арбалатәуп	показывать общий список
иеиҵацалоу адыргаҷқәа аднакылаӡом	сжатые значки не поддерживаются
ижәпаны аҭыԥыркра ахархәара	использовать плотное размещение
изаамҭанытәиу аҭаӡ азы агәылаҵа аԥҵатәуп	создать закладку для текущей папки
изныԥшо афаил ахкы алхтәуп	выбрать отображаемые типы файлов
изхылҵыз аԥенџьыр ақәгараан ари аԥенџьыр ықәгахома	уничтожается ли это окно при уничтожении родительского окна
изымуа аԥштәы адыррақәа аиуит 	получены недопустимые данные цвета 
